Downer,Downer - ODM,MD-01-08-05-AH,Supply and installation of appropriate fire stopping method as required outside working hours,Per Penetration," $	54.6",,45214
Downer,Downer - ODM,MD-02-01-01,Installation of a single service drop sheath (SDS) on a single span to a multi dwelling unit,Per aerial service drop," $	213.05",,45214
Downer,Downer - ODM,MD-02-01-02,Extra over rate for additional spans for an aerial service drop to a multi dwelling unit,Each additional Span," $	45.63",,45214
Downer,Downer - ODM,MD-02-01-03,Extra over rate for supply and installation of an raiser pole on a building.,Each raiser pole installed," $	96.03",,45214
Downer,Downer - ODM,MD-02-01-04,Installation of service drop sheath underground to a multi dwelling unit,Per service drop," $	165.25",,45214
Downer,Downer - ODM,MD-02-01-05,Installation of direct service drop sheath underground to a multi dwelling unit,Per direct service drop," $	287.95",,45214
Downer,Downer - ODM,MD-02-01-10,Extend a developer supplied MDU lead-in starter pipe to the nominated network pit,Per Starter Pipe," $	168.7",,45214
Downer,Downer - ODM,MD-02-02-01,Replace existing copper aerial lead-in with new copper aerial lead-in to a multi dwelling unit,"Per existing copper aerial lead-in replaced. Per
Span"," $	165.26",,45214
Downer,Downer - ODM,MD-02-02-02,Installation of aerial copper service drop to a multi dwelling unit,Per aerial copper service drop," $	161.46",,45214
Downer,Downer - ODM,MD-02-02-03,Installation of non-aerial copper service drop to a multi dwelling unit,Per non-aerial copper service drop," $	112.44",,45214
Downer,Downer - ODM,MD-02-03-01,Installation of a coaxial drop cable on a single span to a multi dwelling unit,Per aerial service drop," $	140",,45214
Downer,Downer - ODM,MD-02-03-02,Extra over rate for installation of a new coaxial drop cable in-span to a multi dwelling unit,Per in-span Drop," $	70",,45214
Downer,Downer - ODM,MD-02-03-03,Extra over rate for additional spans for a aerial coaxial service drop to a multi dwelling unit,Each additional Span," $	121.44",,45214
Downer,Downer - ODM,MD-02-03-04,Installation of non-aerial coaxial service drop to a multi dwelling unit,Per coaxial service drop," $	131.68",,45214
Downer,Downer - ODM,MD-02-03-05,Extra over for supply and Installation of rooftop raiser on a building,Per raiser pole installed," $	90",,45214
Downer,Downer - ODM,SD-01-01-01,Extra over rate for the supply and install of new lead- in pipe  minimum charge 6 metres route length  by any means,Per linear metre," $	32.86",,45214
Downer,Downer - ODM,SD-01-01-02,Extra over rate for supply and installation of an raiser pole on a building.,Per raiser pole," $	125",,45214
Downer,Downer - ODM,SD-01-01-03,Supply and install of Y connectors,Per Y connector," $	75.29",,45214
Downer,Downer - ODM,SD-01-01-04,Supply and install new lead-in starter pipe,Per Starter Pipe," $	150",,45214
Downer,Downer - ODM,SD-01-01-05,Extra over rate for the supply and install of new lead- in starter pipe greater than 2 meters in length,Per linear metre," $	37.09",,45214
Downer,Downer - ODM,SD-01-02-01,Extra over rate to repair lead-in conduit,Per repaired lead-in conduit," $	71.21",,45214
Downer,Downer - ODM,SD-02-01-01,Installation of a single service drop sheath on a single span to a single dwelling unit,Per aerial service drop," $	213.05",,45214
Downer,Downer - ODM,SD-02-01-02,Extra over rate for additional spans for an aerial service drop to a single dwelling unit,Each additional Span," $	45.63",,45214
Downer,Downer - ODM,SD-02-01-03,Installation of service drop sheath underground to a single dwelling unit,Per service drop," $	165.25",,45214
Downer,Downer - ODM,SD-02-01-04,Installation of direct service drop sheath underground to a single dwelling unit,Per direct service drop," $	287.95",,45214
Downer,Downer - ODM,SD-02-02-01,Replace existing copper aerial lead-in with new copper aerial lead-in to a single dwelling unit,"Per existing copper aerial lead-in
replaced. Per Span"," $	121.89",,45214
Downer,Downer - ODM,SD-02-02-02,Installation of aerial copper service drop to a single dwelling unit,Per aerial copper service drop," $	120",,45214
Downer,Downer - ODM,SD-02-02-03,Installation of non-aerial copper service drop to a single dwelling unit,Per non-aerial copper service drop," $	89.57",,45214
Downer,Downer - ODM,SD-02-02-04,Extra over rate for installation of a new copper drop cable in-span to a single dwelling unit,Per in-span Drop," $	105",,45214
Downer,Downer - ODM,SD-02-03-01,Installation of a coaxial drop cable on a single span to a single dwelling unit,Per aerial service drop," $	140",,45214
Downer,Downer - ODM,SD-02-03-02,Extra over rate for installation of a new coaxial drop cable in-span to a single dwelling unit,Per in-span Drop," $	71.54",,45214
Downer,Downer - ODM,SD-02-03-03,Extra over rate for additional spans for a aerial coaxial service drop to a single dwelling unit,Each additional Span," $	164.5",,45214
Downer,Downer - ODM,SD-02-03-04,Installation of non-aerial coaxial service drop to a single dwelling unit,Per coaxial service drop," $	115",,45214
Downer,Downer - ODM,CC-01-01-01,Installation  commissioning and integration of a Enterprise Ethernet B-NTD in a wall mounted environment,Per B-NTD," $	141.7",,45214
Downer,Downer - ODM,CC-01-01-02,Installation  commissioning and integration of a Enterprise Ethernet B-NTD in a rack mounted environment,Per B-NTD," $	145",,45214
Downer,Downer - ODM,CC-01-01-03,Installation  commissioning and activation of a GPON B-NTD in a wall mounted environment,Per B-NTD," $	125",,45214
Downer,Downer - ODM,CC-01-01-04,Installation  commissioning and activation of a GPON B-NTD in a rack mounted environment,Per B-NTD," $	125",,45214
Downer,Downer - ODM,CC-01-01-05,Installation of battery back-up unit in conjunction with BNTD installation,Per Battery Backup Device," $	25.44",,45214
Downer,Downer - ODM,CC-01-01-06,Installation of a Fibre TV Receiver (TVR) co-located with an NTD,Per device," $	9.1",,45214
Downer,Downer - ODM,CC-01-02-01,Installation  commissioning and integration of a R- NTD in a wall mounted environment,Per device," $	134.24",,45214
Downer,Downer - ODM,CC-01-02-02,Installation  commissioning and integration of a R- NTD in a rack mounted environment,Per device," $	130.77",,45214
Downer,Downer - ODM,CC-01-02-03,Internal wiring from exterior termination outlet enclosure to internal wall plate/TO,Per wall plate," $	60.49",,45214
Downer,Downer - ODM,CC-02-01-01,Replace existing lead in termination enclosure,Per enclosure," $	43.45",,45214
Downer,Downer - ODM,CC-03-01-01,Remove existing aerial lead in equipment from lead- in termination enclosure to NTD,Per NTD," $	61",,45214
Downer,Downer - ODM,CC-03-01-02,Remove existing non-aerial lead in equipment from lead-in termination enclosure to NTD,Per NTD," $	50",,45214
Downer,Downer - ODM,CF-02-02-1TT,1 x Tech in a truck,Per KM," $	0.94",,45214
Downer,Downer - ODM,CF-02-02-1TU,1 x Tech in a van (UTE),Per KM," $	0.86",,45214
Downer,Downer - ODM,CF-02-02-2TT,2 x Tech in a truck,Per KM," $	1.44",,45214
Downer,Downer - ODM,CF-02-02-2TU,2 x Tech in a van (UTE),Per KM," $	1.38",,45214
Downer,Downer - ODM,CF-03-02-01,"LAFHA for Planning and Design or Construction Works for a Work Order located in Zone 2
(Submit Quote to Downer for Approval - No. of crew x days)",Per Night / Per Person," $	160",,45214
Downer,Downer - ODM,CF-03-02-02,"LAFHA for Planning and Design or Construction Works for a Work Order located in Zone 3
(Submit Quote to Downer for Approval - No. of crew x days)",Per Night / Per Person," $	160",,45214
Downer,Downer - ODM,CF-03-02-03,"LAFHA for Planning and Design or Construction Works for a Work Order located in Zone 4
(Submit Quote to Downer for Approval - No. of crew x days)",Per Night / Per Person," $	160",,45214
Downer,Downer - ODM,TB-01-03-01,Electrician (inclusive plant and equipment),Per hour," $	72",,45214
Downer,Downer - ODM,TB-01-03-01-AH,Electrician (inclusive plant and equipment)  outside working hours,Per hour," $	93.6",,45214
Downer,Downer - ODM,TB-01-03-02,Fibre Technician (inclusive plant and equipment),Per hour," $	70",,45214
Downer,Downer - ODM,TB-01-03-02-AH,Fibre Technician (inclusive plant and equipment)  outside working hours,Per hour," $	91",,45214
Downer,Downer - ODM,TB-01-03-03,Labourer,Per hour," $	38.5",,45214
Downer,Downer - ODM,TB-01-03-03-AH,Labourer - outside working hours,Per hour," $	50.7",,45214
Downer,Downer - ODM,TB-01-03-04,Plant Operator,Per hour," $	45",,45214
Downer,Downer - ODM,TB-01-03-04-AH,Plant Operator  outside working hours,Per hour," $	58.5",,45214
Downer,Downer - ODM,TB-01-03-05,Advanced pole inspector (inclusive plant and equipment),Per hour," $	63",,45214
Downer,Downer - ODM,TB-01-03-05-AH,Advanced pole inspector (inclusive plant and equipment)  - outside working hours,Per hour," $	81.9",,45214
Downer,Downer - ODM,TB-01-03-06,Telecommunication Technician (inclusive plant and equipment),Per hour," $	70",,45214
Downer,Downer - ODM,TB-01-03-06-AH,Telecommunication Technician (inclusive plant and equipment) - outside working hours,Per hour," $	91",,45214
Downer,Downer - ODM,TB-01-03-07,Designer,Per hour," $	75",,45214
Downer,Downer - ODM,TB-01-03-07-AH,Designer - outside working hours,Per hour," $	97.5",,45214
Downer,Downer - ODM,TB-01-03-08,Copper Technician (inclusive plant and equipment),Per hour," $	88.4",,45214
Downer,Downer - ODM,TB-01-03-08-AH,Copper Technician (inclusive plant and equipment)  outside working hours,Per hour," $	88.4",,45214
Downer,Downer - ODM,TB-02-02-01,Provision of float charges for the movement of large plant and equipment between work sites,Per km," $	5.5",,45214
Downer,Downer - ODM,TB-02-02-02,Single-axle tipper truck 5 tonne load,Per Day," $	313",,45214
Downer,Downer - ODM,TB-02-02-03,EWP truck mounted up to 12m,Per Day," $	660",,45214
Downer,Downer - ODM,TB-02-02-04,Fully equipped vehicle for electrical technician,Per Day," $	128.61",,45214
Downer,Downer - ODM,TB-02-02-05,Fully equipped vehicle for fibre technician,Per Day," $	159.12",,45214
Downer,Downer - ODM,TB-02-02-06,Bobcat with 4-in-1 bucket,Per Day," $	627.91",,45214
Downer,Downer - ODM,TB-02-02-07,Backhoe  JCB3CX or equivalent,Per Day," $	667.16",,45214
Downer,Downer - ODM,TB-02-02-08,Excavators up to 10 tonnes,Per Day," $	667.16",,45214
Downer,Downer - ODM,TB-02-02-09,Excavators 10 to 15 tonnes,Per Day," $	902.62",,45214
Downer,Downer - ODM,TB-02-02-10,Excavators up to 10 tonnes fitted with rock breaker,Per Day," $	1255.82",,45214
Downer,Downer - ODM,TB-02-02-11,Double-axle tipper truck 9 tonne load,Per Day," $	706.4",,45214
Downer,Downer - ODM,TB-02-02-12,Dozer (306 - 400 kw),Per Day," $	1098.85",,45214
Downer,Downer - ODM,TB-02-02-13,Scissor Lift,Per Day," $	512.24",,45214
Downer,Downer - ODM,TB-02-02-14,Vac Truck,Per Day," $	1500",,45214
Downer,Downer - ODM,NC-01-01-01,Supply and install pipe seal 20mm  50mm or 100mm (T-DUX),Each Seal," $	50.9",,45214
Downer,Downer - ODM,NC-01-01-02,Supply and install pipe seal 50mm (Tyco Product Jackmoon),Each Seal," $	80",,45214
Downer,Downer - ODM,NC-01-01-03,Manhole Bearers,Per Pair," $	30",,45214
Downer,Downer - ODM,99-00-00-04,Third Party Requirement - Quote,Quote," $	1",,45214
Downer,Downer - ODM,99-00-00-10,Clean out of an Asbestos Single Lid Pit (includes transportation and disposal at Approved ACM Location),Per Clean Out," $	40",,45214
Downer,Downer - ODM,99-00-00-12,"Clean out of an Asbestos Double Lid Pit (includes transportation and disposal at Approved ACM
Location)",Per Clean Out," $	50",,45214
Downer,Downer - ODM,99-00-00-13,Clean out of an Asbestos Triple Lid Pit (includes transportation and disposal at Approved ACM Location),Per Clean Out," $	60",,45214
Downer,Downer - ODM,99-00-00-14,ACM - Drilling into Asbestos wall or pit (includes transportation and disposal at Approved ACM Location),Each (1x per Location)," $	126",,45214
Downer,Downer - ODM,99-00-00-14X,Extra Over ACM - Drilling into Asbestos wall or pit (includes transportation and disposal at Approved ACM Location) at the same pit / location,Each," $	5",,45214
Downer,Downer - ODM,99-00-00-15,ACM - Breakout existing Asbestos Pipe (includes transportation and disposal at Approved ACM Location),Per Linear Metre," $	110",,45214
Downer,Downer - ODM,99-00-00-20,DTOW,Per Work Order," $	160",,45214
Downer,Downer - ODM,99-00-00-21,Design Survey Activities for a Business Site,Per Work Order," $	280",,45214
Downer,Downer - ODM,PD-02-03-09S,Provision for planning and design activities for a Distribution Fibre Link in a Work Order less than or equal to 500 meters,Per Work Order," $	300",,45214
Downer,Downer - ODM,PD-02-03-10S,Provision for Design Survey activities for a Distribution Fibre Link in a Work Order up to and including 1km,Per Work Order," $	320",,45214
Downer,Downer - ODM,PD-02-03-11S,Provision for Design Survey activities for a Distribution Fibre Link in a Work Order above 1km,Per Work Order," $	360",,45214
