Lend Lease,Lend Lease - ODM,MD-01-07-04/01-01,Installation of a fibre wall outlet,Per outlet," $	19.96 ",Installation of a fibre wall outlet,45403

Lend Lease,Lend Lease - ODM,MD-01-07-04-AH/01-01,Installation of a fibre wall outlet outside working hours,Per outlet," $	23.34 ",Installation of a fibre wall outlet outside working hours,45403

Lend Lease,Lend Lease - ODM,MD-01-07-06/01-01,Installation of apartment amplifier in buildings,Per amplifier," $	88.61 ",Installation of apartment amplifier in buildings,45403

Lend Lease,Lend Lease - ODM,MD-01-07-07/01-01,Installation of MDU security enclosure,Per MDU security enclosure," $	68.30 ",Installation of MDU security enclosure,45403

Lend Lease,Lend Lease - ODM,MD-01-07-08/01-01,Installation of tap in buildings,Per tap," $	71.56 ",Installation of tap in buildings,45403

Lend Lease,Lend Lease - ODM,MD-01-07-09/01-01,Installation of directional coupler or splitter in buildings,Per directional coupler or splitter," $	71.56 ",Installation of directional coupler or splitter in buildings,45403

Lend Lease,Lend Lease - ODM,MD-01-07-10/01-01,Extra over rate for the Installation of an isolator in buildings,Per Isolator," $	14.21 ",Extra over rate for the Installation of an isolator in buildings,45403

Lend Lease,Lend Lease - ODM,MD-01-07-11/01-01,Replacement of tap in buildings,Per Tap," $	54.69 ",Replacement of tap in buildings,45403

Lend Lease,Lend Lease - ODM,MD-01-07-12/01-01,Replacement of tap faceplate in buildings,Per face plate," $	36.98 ",Replacement of tap faceplate in buildings,45403

Lend Lease,Lend Lease - ODM,MD-01-07-13/01-01,"Removal of tap, isolator, directional coupler or splitter in buildings only",Per device," $	47.81 ","Removal of tap, isolator, directional coupler or splitter in buildings only",45403

Lend Lease,Lend Lease - ODM,MD-01-07-14/01-01,Removal of an apartment amplifier in buildings,per device," $	57.37 ",Removal of an apartment amplifier in buildings,45403

Lend Lease,Lend Lease - ODM,MD-01-07-15/01-01,Installation of Building Fibre Distributor (BUDI),Each BFD," $	346.65 ",Installation of Building Fibre Distributor (BUDI),45403

Lend Lease,Lend Lease - ODM,MD-01-07-15-AH/01-01,Installation of Building Fibre Distributor (BUDI) outside working hours,Each BFD," $	450.64 ",Installation of Building Fibre Distributor (BUDI) outside working hours,45403

Lend Lease,Lend Lease - ODM,MD-01-07-16/01-01,Installation of Splitter Distribution Terminal (SDT),Each SDT," $	189.79 ",Installation of Splitter Distribution Terminal (SDT),45403

Lend Lease,Lend Lease - ODM,MD-01-07-16-AH/01-01,Installation of Splitter Distribution Terminal (SDT) outside working hours,Each SDT," $	246.73 ",Installation of Splitter Distribution Terminal (SDT) outside working hours,45403

Lend Lease,Lend Lease - ODM,MD-01-07-17/01-01,Installation of additional NG4 tray,per device," $	26.14 ",Installation of additional NG4 tray,45403

Lend Lease,Lend Lease - ODM,MD-01-07-18/01-01,Installation of additional OCM-6 module,per device," $	36.59 ",Installation of additional OCM-6 module,45403

Lend Lease,Lend Lease - ODM,MD-01-07-19/01-01,Installation of additional PCD splice tray,per device," $	31.38 ",Installation of additional PCD splice tray,45403

Lend Lease,Lend Lease - ODM,MD-01-08-01/01-01,Provide a wall penetration in brick or concrete wall only,Each wall penetration," $	103.36 ",Provide a wall penetration in brick or concrete wall only,45403

Lend Lease,Lend Lease - ODM,MD-01-08-01-AH/01-01,Provide a wall penetration in brick or concrete wall only outside working hours,Each wall penetration," $	183.44 ",Provide a wall penetration in brick or concrete wall only outside working hours,45403

Lend Lease,Lend Lease - ODM,MD-01-08-02/01-01,Provide a wall penetration in a plasterboard wall only,Each wall penetration," $	4.58 ",Provide a wall penetration in a plasterboard wall only,45403

Lend Lease,Lend Lease - ODM,MD-01-08-02-AH/01-01,Provide a wall penetration in a plasterboard wall only outside working hours,Each wall penetration," $	6.56 ",Provide a wall penetration in a plasterboard wall only outside working hours,45403

Lend Lease,Lend Lease - ODM,MD-01-08-03/01-01,Provide a floor penetration above 50mm diameter,Each floor penetration," $	297.39 ",Provide a floor penetration above 50mm diameter,45403

Lend Lease,Lend Lease - ODM,MD-01-08-03-AH/01-01,Provide a floor penetration above 50mm diameter outside working hours,Each floor penetration," $	321.26 ",Provide a floor penetration above 50mm diameter outside working hours,45403

Lend Lease,Lend Lease - ODM,MD-01-08-04/01-01,Provide a floor penetration up to and including 50mm diameter,Each floor penetration," $	172.88 ",Provide a floor penetration up to and including 50mm diameter,45403

Lend Lease,Lend Lease - ODM,MD-01-08-04-AH/01-01,Provide a floor penetration up to and including 50mm diameter outside working hours,Each floor penetration," $	260.06 ",Provide a floor penetration up to and including 50mm diameter outside working hours,45403

Lend Lease,Lend Lease - ODM,MD-01-08-05/01-01,Supply and installation of appropriate fire stopping method as required,Per Penetration," $	52.78 ",Supply and installation of appropriate fire stopping method as required,45403

Lend Lease,Lend Lease - ODM,MD-01-08-05-AH/01-01,Supply and installation of appropriate fire stopping method as required outside working hours,Per Penetration," $	68.61 ",Supply and installation of appropriate fire stopping method as required outside working hours,45403

Lend Lease,Lend Lease - ODM,MD-02-01-01/01-01,Installation of a single service drop sheath (SDS) on a single span to a multi dwelling unit,Per aerial service drop," $	165.66 ",Installation of a single service drop sheath (SDS) on a single span to a multi dwelling unit,45403

Lend Lease,Lend Lease - ODM,MD-02-01-02/01-01,Extra over rate for additional spans for an aerial service drop to a multi dwelling unit,Each additional Span," $	99.14 ",Extra over rate for additional spans for an aerial service drop to a multi dwelling unit,45403

Lend Lease,Lend Lease - ODM,MD-02-01-03/01-01,Extra over rate for supply and installation of an raiser pole on a building.,Each raiser pole installed," $	65.42 ",Extra over rate for supply and installation of an raiser pole on a building.,45403

Lend Lease,Lend Lease - ODM,MD-02-01-04/01-01,Installation of service drop sheath underground to a multi dwelling unit,Per service drop," $	206.45 ",Installation of service drop sheath underground to a multi dwelling unit,45403

Lend Lease,Lend Lease - ODM,MD-02-01-05/01-01,Installation of direct service drop sheath underground to a multi dwelling unit,Per direct service drop," $	214.68 ",Installation of direct service drop sheath underground to a multi dwelling unit,45403

Lend Lease,Lend Lease - ODM,MD-02-01-10/01-01,Extend a developer supplied MDU lead-in starter pipe to the nominated network pit,Per Starter Pipe," $	262.38 ",Extend a developer supplied MDU lead-in starter pipe to the nominated network pit,45403

Lend Lease,Lend Lease - ODM,MD-02-02-01/01-01,Replace existing copper aerial lead-in with new copper aerial lead-in to a multi dwelling unit,Per existing copper aerial lead-in replaced. Per Span," $	209.28 ",Replace existing copper aerial lead-in with new copper aerial lead-in to a multi dwelling unit,45403

Lend Lease,Lend Lease - ODM,MD-02-02-02/01-01,Installation of aerial copper service drop to a multi dwelling unit,Per aerial copper service drop," $	209.28 ",Installation of aerial copper service drop to a multi dwelling unit,45403

Lend Lease,Lend Lease - ODM,MD-02-02-03/01-01,Installation of non-aerial copper service drop to a multi dwelling unit,Per non-aerial copper service drop," $	112.02 ",Installation of non-aerial copper service drop to a multi dwelling unit,45403

Lend Lease,Lend Lease - ODM,MD-02-03-01/01-01,Installation of a coaxial drop cable on a single span to a multi dwelling unit,Per aerial service drop," $	129.09 ",Installation of a coaxial drop cable on a single span to a multi dwelling unit,45403

Lend Lease,Lend Lease - ODM,MD-02-03-02/01-01,Extra over rate for installation of a new coaxial drop cable in-span to a multi dwelling unit,Per in-span Drop," $	51.97 ",Extra over rate for installation of a new coaxial drop cable in-span to a multi dwelling unit,45403

Lend Lease,Lend Lease - ODM,MD-02-03-03/01-01,Extra over rate for additional spans for a aerial coaxial service drop to a multi dwelling unit,Each additional Span," $	76.29 ",Extra over rate for additional spans for a aerial coaxial service drop to a multi dwelling unit,45403

Lend Lease,Lend Lease - ODM,MD-02-03-04/01-01,Installation of non-aerial coaxial service drop to a multi dwelling unit,Per coaxial service drop," $	122.45 ",Installation of non-aerial coaxial service drop to a multi dwelling unit,45403

Lend Lease,Lend Lease - ODM,MD-02-03-05/01-01,Extra over for supply and Installation of rooftop raiser on a building,Per raiser pole installed," $	74.72 ",Extra over for supply and Installation of rooftop raiser on a building,45403

Lend Lease,Lend Lease - ODM,MD-03-02-01/01-01,Separable Portion Documentation Fee,Per Workorder," $	193.84 ",Separable Portion Documentation Fee,45403

Lend Lease,Lend Lease - ODM,MD-03-02-02/01-01,Installation of Splitter for RF / Wired TV,Per Device," $	19.96 ",Installation of Splitter for RF / Wired TV,45403

Lend Lease,Lend Lease - ODM,MD-03-02-03/01-01,Extra-over for Installation of Fibre TV receiver co- located with an NTD,Per Device," $	19.21 ",Extra-over for Installation of Fibre TV receiver co- located with an NTD,45403

Lend Lease,Lend Lease - ODM,PD-05-01-01/01-01,Pit and Pipe inspection for certification of Third Party Works,Per Pit," $	32.16 ",Pit and Pipe inspection for certification of Third Party Works,45403

Lend Lease,Lend Lease - ODM,PS-01-01-01/01-01,Telecommunications service provider fees,Amount of the fee," $	1.00 ",Telecommunications service provider fees,45403

Lend Lease,Lend Lease - ODM,PS-01-01-02/01-01,Pole make ready works,Cost of pole make ready works," $	1.00 ",Pole make ready works,45403

Lend Lease,Lend Lease - ODM,PS-01-01-03/01-01,Supply and install standard GPO as per design,Cost of GPO installation," $	1.00 ",Supply and install standard GPO as per design,45403

Lend Lease,Lend Lease - ODM,PS-01-01-04/01-01,Certification and professional services fees associated with activities not otherwise specified in Activity Scope,Amount of the fee," $	1.00 ",Certification and professional services fees associated with activities not otherwise specified in Activity Scope,45403

Lend Lease,Lend Lease - ODM,PS-01-01-05/01-01,Registered Surveyor Works,Amount of the fee," $	1.00 ",Registered Surveyor Works,45403

Lend Lease,Lend Lease - ODM,PS-01-01-06/01-01,Contaminated Waste Material Removal,Amount of the fee," $	1.00 ",Contaminated Waste Material Removal,45403

Lend Lease,Lend Lease - ODM,PS-01-01-07/01-01,Traffic Control - All costs associated with the hire of professional traffic control units,Amount of the fee," $	1.00 ",Traffic Control - All costs associated with the hire of professional traffic control units,45403

Lend Lease,Lend Lease - ODM,PS-01-01-08/01-01,Local Authority Charges,Amount of the fee," $	1.00 ",Local Authority Charges,45403

Lend Lease,Lend Lease - ODM,PS-01-01-09/01-01,Council breakout and reinstatement,Amount of the fee," $	1.00 ",Council breakout and reinstatement,45403

Lend Lease,Lend Lease - ODM,PS-01-01-10/01-01,Construction works in building not contained within the Activity Scope,Cost of the works and fees," $	1.00 ",Construction works in building not contained within the Activity Scope,45403

Lend Lease,Lend Lease - ODM,PS-01-01-11/01-01,Aerial pole replacement,Amount of the fee," $	1.00 ",Aerial pole replacement,45403

Lend Lease,Lend Lease - ODM,PS-01-01-12/01-01,Third party aerial design management fees,Amount of the fee," $	1.00 ",Third party aerial design management fees,45403

Lend Lease,Lend Lease - ODM,PS-01-01-13/01-01,Supply and install electricity connection as per design,Amount of the fee," $	1.00 ",Supply and install electricity connection as per design,45403

Lend Lease,Lend Lease - ODM,SA-01-01-01/01-01,Service activation Pre-Scope,Per Workorder," $	52.37 ",Service activation Pre-Scope,45403

Lend Lease,Lend Lease - ODM,SD-01-01-01/01-01,"Extra over rate for the supply and install of new lead-in pipe, minimum charge 6 metres route length, by any means",Per linear metre," $	36.35 ","Extra over rate for the supply and install of new lead-in pipe, minimum charge 6 metres route length, by any means",45403

Lend Lease,Lend Lease - ODM,SD-01-01-02/01-01,Extra over rate for supply and installation of an raiser pole on a building.,Per raiser pole," $	74.72 ",Extra over rate for supply and installation of an raiser pole on a building.,45403

Lend Lease,Lend Lease - ODM,SD-01-01-03/01-01,Supply and install of Y connectors,Per Y connector," $	114.37 ",Supply and install of Y connectors,45403

Lend Lease,Lend Lease - ODM,SD-01-01-04/01-01,Supply and install new lead-in starter pipe,Per Starter Pipe," $	82.31 ",Supply and install new lead-in starter pipe,45403

Lend Lease,Lend Lease - ODM,SD-01-01-05/01-01,Extra over rate for the supply and install of new lead-in starter pipe greater than 2 meters in length,Per linear metre," $	40.28 ",Extra over rate for the supply and install of new lead-in starter pipe greater than 2 meters in length,45403

Lend Lease,Lend Lease - ODM,SD-01-02-01/01-01,Extra over rate to repair lead-in conduit,Per repaired lead-in conduit," $	41.32 ",Extra over rate to repair lead-in conduit,45403

Lend Lease,Lend Lease - ODM,SD-02-01-01/01-01,Installation of a single service drop sheath on a single span to a single dwelling unit,Per aerial service drop," $	165.66 ",Installation of a single service drop sheath on a single span to a single dwelling unit,45403

Lend Lease,Lend Lease - ODM,SD-02-01-02/01-01,Extra over rate for additional spans for an aerial service drop to a single dwelling unit,Each additional Span," $	99.14 ",Extra over rate for additional spans for an aerial service drop to a single dwelling unit,45403

Lend Lease,Lend Lease - ODM,SD-02-01-03/01-01,Installation of service drop sheath underground to a single dwelling unit,Per service drop," $	143.40 ",Installation of service drop sheath underground to a single dwelling unit,45403

Lend Lease,Lend Lease - ODM,SD-02-01-04/01-01,Installation of direct service drop sheath underground to a single dwelling unit,Per direct service drop," $	258.84 ",Installation of direct service drop sheath underground to a single dwelling unit,45403

Lend Lease,Lend Lease - ODM,SD-02-02-01/01-01,Replace existing copper aerial lead-in with new copper aerial lead-in to a single dwelling unit,Per existing copper aerial lead-in replaced. Per Span," $	147.33 ",Replace existing copper aerial lead-in with new copper aerial lead-in to a single dwelling unit,45403

Lend Lease,Lend Lease - ODM,SD-02-02-02/01-01,Installation of aerial copper service drop to a single dwelling unit,Per aerial copper service drop," $	172.10 ",Installation of aerial copper service drop to a single dwelling unit,45403

Lend Lease,Lend Lease - ODM,SD-02-02-03/01-01,Installation of non-aerial copper service drop to a single dwelling unit,Per non-aerial copper service drop," $	131.09 ",Installation of non-aerial copper service drop to a single dwelling unit,45403

Lend Lease,Lend Lease - ODM,SD-02-02-04/01-01,Extra over rate for installation of a new copper drop cable in-span to a single dwelling unit,Per in-span Drop," $	125.06 ",Extra over rate for installation of a new copper drop cable in-span to a single dwelling unit,45403

Lend Lease,Lend Lease - ODM,SD-02-03-01/01-01,Installation of a coaxial drop cable on a single span to a single dwelling unit,Per aerial service drop," $	129.09 ",Installation of a coaxial drop cable on a single span to a single dwelling unit,45403

Lend Lease,Lend Lease - ODM,SD-02-03-02/01-01,Extra over rate for installation of a new coaxial drop cable in-span to a single dwelling unit,Per in-span Drop," $	59.81 ",Extra over rate for installation of a new coaxial drop cable in-span to a single dwelling unit,45403

Lend Lease,Lend Lease - ODM,SD-02-03-03/01-01,Extra over rate for additional spans for a aerial coaxial service drop to a single dwelling unit,Each additional Span," $	78.56 ",Extra over rate for additional spans for a aerial coaxial service drop to a single dwelling unit,45403

Lend Lease,Lend Lease - ODM,SD-02-03-04/01-01,Installation of non-aerial coaxial service drop to a single dwelling unit,Per coaxial service drop," $	84.26 ",Installation of non-aerial coaxial service drop to a single dwelling unit,45403

Lend Lease,Lend Lease - ODM,TB-01-01-01/01-01,Electrician (inclusive plant and equipment),Per hour," $	67.61 ",Electrician (inclusive plant and equipment),45403

Lend Lease,Lend Lease - ODM,TB-01-01-01-AH/01-01,Electrician (inclusive plant and equipment)  outside working hours,Per Hour," $	91.93 ",Electrician (inclusive plant and equipment)  outside working hours,45403

Lend Lease,Lend Lease - ODM,TB-01-01-02/01-01,Fibre Technician (inclusive plant and equipment),Per hour," $	58.10 ",Fibre Technician (inclusive plant and equipment),45403

Lend Lease,Lend Lease - ODM,TB-01-01-02-AH/01-01,Fibre Technician (inclusive plant and equipment)  outside working hours,Per Hour," $	83.48 ",Fibre Technician (inclusive plant and equipment)  outside working hours,45403

Lend Lease,Lend Lease - ODM,TB-01-01-03/01-01,Labourer,Per hour," $	58.09 ",Labourer,45403

Lend Lease,Lend Lease - ODM,TB-01-01-03-AH/01-01,Labourer - outside working hours,Per Hour," $	75.53 ",Labourer - outside working hours,45403

Lend Lease,Lend Lease - ODM,TB-01-01-04/01-01,Plant Operator,Per hour," $	83.48 ",Plant Operator,45403

Lend Lease,Lend Lease - ODM,TB-01-01-04-AH/01-01,Plant Operator  outside working hours,Per Hour," $	108.52 ",Plant Operator  outside working hours,45403

Lend Lease,Lend Lease - ODM,TB-01-01-05/01-01,Advanced pole inspector (inclusive plant and equipment),Per hour," $	32.65 ",Advanced pole inspector (inclusive plant and equipment),45403

Lend Lease,Lend Lease - ODM,TB-01-01-05-AH/01-01,Advanced pole inspector (inclusive plant and equipment)  - outside working hours,Per Hour," $	100.03 ",Advanced pole inspector (inclusive plant and equipment)  - outside working hours,45403

Lend Lease,Lend Lease - ODM,TB-01-01-06/01-01,Telecommunication Technician (inclusive plant and equipment),Per hour," $	50.74 ",Telecommunication Technician (inclusive plant and equipment),45403

Lend Lease,Lend Lease - ODM,TB-01-01-06-AH/01-01,Telecommunication Technician  (inclusive plant and equipment) - outside working hours,Per Hour," $	112.70 ",Telecommunication Technician  (inclusive plant and equipment) - outside working hours,45403

Lend Lease,Lend Lease - ODM,TB-01-01-07/01-01,Designer,Per hour," $	34.57 ",Designer,45403

Lend Lease,Lend Lease - ODM,TB-01-01-07-AH/01-01,Designer - outside working hours,Per Hour," $	121.91 ",Designer - outside working hours,45403

Lend Lease,Lend Lease - ODM,TB-01-01-08/01-01,Copper Technician (inclusive plant and equipment),Per hour," $	53.72 ",Copper Technician (inclusive plant and equipment),45403

Lend Lease,Lend Lease - ODM,TB-01-01-08-AH/01-01,"Copper Technician (inclusive plant and equipment)
 outside working hours",Per Hour," $	105.19 ","Copper Technician (inclusive plant and equipment)
 outside working hours",45403

Lend Lease,Lend Lease - ODM,TB-01-02-01/01-01,Third party damage report,Per hour," $	69.62 ",Third party damage report,45403

Lend Lease,Lend Lease - ODM,TB-01-03-01/01-01,Electrician (inclusive plant and equipment),Per hour," $	67.61 ",Electrician (inclusive plant and equipment),45403

Lend Lease,Lend Lease - ODM,TB-01-03-01-AH/01-01,Electrician (inclusive plant and equipment)  outside working hours,Per hour," $	91.93 ",Electrician (inclusive plant and equipment)  outside working hours,45403

Lend Lease,Lend Lease - ODM,TB-01-03-02/01-01,Fibre Technician (inclusive plant and equipment),Per hour," $	58.10 ",Fibre Technician (inclusive plant and equipment),45403

Lend Lease,Lend Lease - ODM,TB-01-03-02-AH/01-01,Fibre Technician (inclusive plant and equipment)  outside working hours,Per hour," $	83.48 ",Fibre Technician (inclusive plant and equipment)  outside working hours,45403

Lend Lease,Lend Lease - ODM,TB-01-03-03/01-01,Labourer,Per hour," $	58.09 ",Labourer,45403

Lend Lease,Lend Lease - ODM,TB-01-03-03-AH/01-01,Labourer - outside working hours,Per hour," $	75.53 ",Labourer - outside working hours,45403

Lend Lease,Lend Lease - ODM,TB-01-03-04/01-01,Plant Operator,Per hour," $	83.48 ",Plant Operator,45403

Lend Lease,Lend Lease - ODM,TB-01-03-04-AH/01-01,Plant Operator  outside working hours,Per hour," $	108.52 ",Plant Operator  outside working hours,45403

Lend Lease,Lend Lease - ODM,TB-01-03-05/01-01,Advanced pole inspector (inclusive plant and equipment),Per hour," $	32.65 ",Advanced pole inspector (inclusive plant and equipment),45403

Lend Lease,Lend Lease - ODM,TB-01-03-05-AH/01-01,Advanced pole inspector (inclusive plant and equipment)  - outside working hours,Per hour," $	100.03 ",Advanced pole inspector (inclusive plant and equipment)  - outside working hours,45403

Lend Lease,Lend Lease - ODM,TB-01-03-06/01-01,Telecommunication Technician (inclusive plant and equipment),Per hour," $	50.74 ",Telecommunication Technician (inclusive plant and equipment),45403

Lend Lease,Lend Lease - ODM,TB-01-03-06-AH/01-01,Telecommunication Technician (inclusive plant and equipment) - outside working hours,Per hour," $	112.70 ",Telecommunication Technician (inclusive plant and equipment) - outside working hours,45403

Lend Lease,Lend Lease - ODM,TB-01-03-07/01-01,Designer,Per hour," $	34.57 ",Designer,45403

Lend Lease,Lend Lease - ODM,TB-01-03-07-AH/01-01,Designer - outside working hours,Per hour," $	121.91 ",Designer - outside working hours,45403

Lend Lease,Lend Lease - ODM,TB-01-03-08/01-01,Copper Technician (inclusive plant and equipment),Per hour," $	53.72 ",Copper Technician (inclusive plant and equipment),45403

Lend Lease,Lend Lease - ODM,TB-01-03-08-AH/01-01,"Copper Technician (inclusive plant and equipment)  outside working hours",Per hour," $	105.19 ","Copper Technician (inclusive plant and equipment)  outside working hours",45403

Lend Lease,Lend Lease - ODM,TB-02-02-01/01-01,Provision of float charges for the movement of large plant and equipment between work sites,Per km," $	4.16 ",Provision of float charges for the movement of large plant and equipment between work sites,45403

Lend Lease,Lend Lease - ODM,TB-02-02-02/01-01,Single-axle tipper truck 5 tonne load,Per Day," $	196.46 ",Single-axle tipper truck 5 tonne load,45403

Lend Lease,Lend Lease - ODM,TB-02-02-03/01-01,EWP truck mounted up to 12m,Per Day," $	578.98 ",EWP truck mounted up to 12m,45403

Lend Lease,Lend Lease - ODM,TB-02-02-04/01-01,Fully equipped vehicle for electrical technician,Per Day," $	99.36 ",Fully equipped vehicle for electrical technician,45403

Lend Lease,Lend Lease - ODM,TB-02-02-05/01-01,Fully equipped vehicle for fibre technician,Per Day," $	99.36 ",Fully equipped vehicle for fibre technician,45403

Lend Lease,Lend Lease - ODM,TB-02-02-06/01-01,Bobcat with 4-in-1 bucket,Per Day," $	353.64 ",Bobcat with 4-in-1 bucket,45403

Lend Lease,Lend Lease - ODM,TB-02-02-07/01-01,"Backhoe, JCB3CX or equivalent",Per Day," $	510.82 ","Backhoe, JCB3CX or equivalent",45403

Lend Lease,Lend Lease - ODM,TB-02-02-08/01-01,Excavators up to 10 tonnes,Per Day," $	510.82 ",Excavators up to 10 tonnes,45403

Lend Lease,Lend Lease - ODM,TB-02-02-09/01-01,Excavators 10 to 15 tonnes,Per Day," $	615.86 ",Excavators 10 to 15 tonnes,45403

Lend Lease,Lend Lease - ODM,TB-02-02-10/01-01,Excavators up to 10 tonnes fitted with rock breaker,Per Day," $	776.32 ",Excavators up to 10 tonnes fitted with rock breaker,45403

Lend Lease,Lend Lease - ODM,TB-02-02-11/01-01,Double-axle tipper truck 9 tonne load,Per Day," $	286.06 ",Double-axle tipper truck 9 tonne load,45403

Lend Lease,Lend Lease - ODM,TB-02-02-12/01-01,Dozer (306 - 400 kw),Per Day," $	1436.72 ",Dozer (306 - 400 kw),45403

Lend Lease,Lend Lease - ODM,TB-02-02-13/01-01,Scissor Lift,Per Day," $	244.38 ",Scissor Lift,45403

Lend Lease,Lend Lease - ODM,TB-02-02-14/01-01,Vac Truck,Per Day," $	1400.28 ",Vac Truck,45403
