Lend Lease,Lend Lease - ODM,CP-02-01-06/01-01,Installation of a new Main Cable large copper joint enclosure,Per new Main Cable large Copper joint enclosure," $	2210.72 ",Installation of a new Main Cable large copper joint enclosure,45403

Lend Lease,Lend Lease - ODM,CP-02-01-07/01-01,Installation of a new Main Cable extra large copper joint enclosure,Per new Main Cable extra large Copper joint enclosure," $	4051.12 ",Installation of a new Main Cable extra large copper joint enclosure,45403

Lend Lease,Lend Lease - ODM,CP-02-01-08/01-01,Installation of a new aerial large copper joint,Per new Distribution large copper joint," $	692.75 ",Installation of a new aerial large copper joint,45403

Lend Lease,Lend Lease - ODM,CP-02-01-09/01-01,Installation of a new aerial small copper joint,Per new Distribution small copper joint," $	470.35 ",Installation of a new aerial small copper joint,45403

Lend Lease,Lend Lease - ODM,CP-02-02-01/01-01,Rehabilitate existing Distribution extra large or large openable copper joint,Per large openable copper joint," $	270.59 ",Rehabilitate existing Distribution extra large or large openable copper joint,45403

Lend Lease,Lend Lease - ODM,CP-02-02-02/01-01,Rehabilitate existing Distribution medium or small openable copper joint,Per small openable copper joint," $	169.08 ",Rehabilitate existing Distribution medium or small openable copper joint,45403

Lend Lease,Lend Lease - ODM,CP-02-02-03/01-01,Replacement of existing Distribution in-line copper joint with a new in-line large copper joint,Per existing copper joint replaced," $	665.66 ",Replacement of existing Distribution in-line copper joint with a new in-line large copper joint,45403

Lend Lease,Lend Lease - ODM,CP-02-02-04/01-01,Replacement of existing Distribution in-line copper joint with a new in-line small copper joint,Per existing copper joint replaced," $	412.10 ",Replacement of existing Distribution in-line copper joint with a new in-line small copper joint,45403

Lend Lease,Lend Lease - ODM,CP-02-02-05/01-01,Cutting over existing services from an existing copper joint to a new large copper joint,Per existing copper joint replaced," $	564.64 ",Cutting over existing services from an existing copper joint to a new large copper joint,45403

Lend Lease,Lend Lease - ODM,CP-02-02-06/01-01,Cutting over existing services from an existing copper joint to a new small copper joint,Per existing copper joint replaced," $	316.31 ",Cutting over existing services from an existing copper joint to a new small copper joint,45403

Lend Lease,Lend Lease - ODM,CP-02-02-07/01-01,Rehabilitate existing aerial extra large or large copper joint,Per existing copper joint replaced," $	465.93 ",Rehabilitate existing aerial extra large or large copper joint,45403

Lend Lease,Lend Lease - ODM,CP-02-02-08/01-01,Rehabilitate existing aerial medium or small copper joint,Per existing copper joint replaced," $	385.00 ",Rehabilitate existing aerial medium or small copper joint,45403

Lend Lease,Lend Lease - ODM,CP-02-02-09/01-01,Rehabilitate existing elevated copper joint,Per existing copper joint replaced," $	241.42 ",Rehabilitate existing elevated copper joint,45403

Lend Lease,Lend Lease - ODM,CP-02-02-10/01-01,Rehabilitate existing small Distribution in-line copper joint,Per small in-line copper joint," $	388.74 ",Rehabilitate existing small Distribution in-line copper joint,45403

Lend Lease,Lend Lease - ODM,CP-02-02-15/01-01,Rehabilitate existing extra large or large Distribution in-line copper joint,Per existing copper joint," $	431.93 ",Rehabilitate existing extra large or large Distribution in-line copper joint,45403

Lend Lease,Lend Lease - ODM,CP-02-02-16/01-01,Rehabilitate existing medium Distribution in-line copper joint,Per existing copper joint," $	431.93 ",Rehabilitate existing medium Distribution in-line copper joint,45403

Lend Lease,Lend Lease - ODM,CP-02-02-20/01-01,Joint a working cable pair into an existing joint up to and including a 10 pair cable,Per existing copper joint," $	191.49 ",Joint a working cable pair into an existing joint up to and including a 10 pair cable,45403

Lend Lease,Lend Lease - ODM,CP-02-02-21/01-01,Joint a working cable pair into an existing joint above a 10 pair cable and up to and including a 50 pair cable,Per existing copper joint," $	294.94 ",Joint a working cable pair into an existing joint above a 10 pair cable and up to and including a 50 pair cable,45403

Lend Lease,Lend Lease - ODM,CP-02-02-22/01-01,Joint a working cable pair into an existing joint above a 50 pair cable and up to and including a 100 pair cable,Per existing copper joint," $	335.69 ",Joint a working cable pair into an existing joint above a 50 pair cable and up to and including a 100 pair cable,45403

Lend Lease,Lend Lease - ODM,CP-02-02-23/01-01,Joint a working cable pair into an existing joint above 100 pair cable,Per existing copper joint," $	1855.84 ",Joint a working cable pair into an existing joint above 100 pair cable,45403

Lend Lease,Lend Lease - ODM,CP-02-02-24/01-01,Insert a 2 pair cable into an existing joint and joint to existing cable,Per 2 pair cable," $	40.96 ",Insert a 2 pair cable into an existing joint and joint to existing cable,45403

Lend Lease,Lend Lease - ODM,CP-02-02-25/01-01,"Insert a cable including a 10 pair and up to an including a 100 pair into an existing joint and joint to existing cable",Per Cable inserted," $	437.56 ","Insert a cable including a 10 pair and up to an including a 100 pair into an existing joint and joint to existing cable",45403

Lend Lease,Lend Lease - ODM,CP-02-02-26/01-01,Locate and rectify a fault in a copper pair,Per Copper Cable," $	170.31 ",Locate and rectify a fault in a copper pair,45403

Lend Lease,Lend Lease - ODM,CP-02-03-01/01-01,Removal of existing copper joint,Per existing copper joint," $	43.12 ",Removal of existing copper joint,45403

Lend Lease,Lend Lease - ODM,CP-02-03-02/01-01,Removal of existing aerial copper joint,Per existing copper joint," $	96.55 ",Removal of existing aerial copper joint,45403

Lend Lease,Lend Lease - ODM,CP-02-03-03/01-01,Remove a existing elevated joint,Per existing copper joint," $	84.65 ",Remove a existing elevated joint,45403

Lend Lease,Lend Lease - ODM,CP-02-04-01/01-01,Joint sealing maintenance task (add Dexbond 10B Sealant),Per existing copper joint," $	37.72 ",Joint sealing maintenance task (add Dexbond 10B Sealant),45403

Lend Lease,Lend Lease - ODM,CP-02-04-02/01-01,"Replace joint lid, clamp, or Support Bar   (HSOJ or Dexgreen Joint)",Per existing copper joint," $	18.86 ","Replace joint lid, clamp, or Support Bar   (HSOJ or Dexgreen Joint)",45403

Lend Lease,Lend Lease - ODM,CP-02-04-03/01-01,Replace or install 2-5pr Snap Enclosure,Per existing copper joint," $	25.87 ",Replace or install 2-5pr Snap Enclosure,45403

Lend Lease,Lend Lease - ODM,CP-02-04-04/01-01,Replace or install 10pr Snap Enclosure,Per existing copper joint," $	42.43 ",Replace or install 10pr Snap Enclosure,45403

Lend Lease,Lend Lease - ODM,CP-02-04-05/01-01,Replace connectors in an openable joint,Per existing copper joint," $	28.29 ",Replace connectors in an openable joint,45403

Lend Lease,Lend Lease - ODM,CP-02-04-06/01-01,Replace Bandit Strap,Per existing copper joint," $	30.24 ",Replace Bandit Strap,45403

Lend Lease,Lend Lease - ODM,CP-03-01-01/01-01,Removal of a pair gain system,Per pair gain system," $	252.27 ",Removal of a pair gain system,45403

Lend Lease,Lend Lease - ODM,CP-03-01-02/01-01,Migration of an existing service from a pair gain system to a dedicated copper circuit,Per existing service," $	130.37 ",Migration of an existing service from a pair gain system to a dedicated copper circuit,45403

Lend Lease,Lend Lease - ODM,CP-03-01-03/01-01,Single service active migration in a CSD including service jumpering in the pillar,Per service," $	77.48 ",Single service active migration in a CSD including service jumpering in the pillar,45403

Lend Lease,Lend Lease - ODM,CP-03-01-04/01-01,Removal of existing line conditioning equipment,Per existing line conditioning equipment," $	150.52 ",Removal of existing line conditioning equipment,45403

Lend Lease,Lend Lease - ODM,CP-03-01-05/01-01,Removal of an existing bridge tap,Per existing bridge tap," $	141.19 ",Removal of an existing bridge tap,45403

Lend Lease,Lend Lease - ODM,CP-03-01-06/01-01,Install earth bonding cable between cable sections,Per linear metre," $	7.27 ",Install earth bonding cable between cable sections,45403

Lend Lease,Lend Lease - ODM,CP-03-01-10/01-01,Multiple services pre-validation for migration at any location,Per existing service," $	42.84 ",Multiple services pre-validation for migration at any location,45403

Lend Lease,Lend Lease - ODM,CP-05-01-01/01-01,Installation of service jumpering in an Exchange,Per Service," $	67.78 ",Installation of service jumpering in an Exchange,45403

Lend Lease,Lend Lease - ODM,CP-05-01-02/01-01,Existing service transfer jumpering in an MDF and termination end point,Per existing service," $	73.55 ",Existing service transfer jumpering in an MDF and termination end point,45403

Lend Lease,Lend Lease - ODM,CP-05-02-01/01-01,Installation of service jumpering in a cross connect unit for the first service jumpered,Per Service," $	8.69 ",Installation of service jumpering in a cross connect unit for the first service jumpered,45403

Lend Lease,Lend Lease - ODM,CP-05-02-02/01-01,Extra over service Jumpering in a cross connect unit,Per Service," $	8.69 ",Extra over service Jumpering in a cross connect unit,45403

Lend Lease,Lend Lease - ODM,CW-01-01-01/01-01,Supply and install underground pipe with an internal diameter of more than 25mm and equal to or less than 50mm by any means in other than Rock,Per linear metre," $	40.76 ",Supply and install underground pipe with an internal diameter of more than 25mm and equal to or less than 50mm by any means in other than Rock,45403

Lend Lease,Lend Lease - ODM,CW-01-01-02/01-01,Supply and install underground pipe with an internal diameter of greater than 50mm by any means in other than Rock,Per linear metre," $	47.06 ",Supply and install underground pipe with an internal diameter of greater than 50mm by any means in other than Rock,45403

Lend Lease,Lend Lease - ODM,CW-01-01-03/01-01,Extra over for supply and install an additional underground pipe in an existing trench with an internal diameter of greater than 25mm,Per linear metre," $	11.01 ",Extra over for supply and install an additional underground pipe in an existing trench with an internal diameter of greater than 25mm,45403

Lend Lease,Lend Lease - ODM,CW-01-01-04/01-01,Extra over for supply and install an additional underground pipe by boring technique with an internal diameter of greater than 25mm,Per linear metre," $	47.24 ",Extra over for supply and install an additional underground pipe by boring technique with an internal diameter of greater than 25mm,45403

Lend Lease,Lend Lease - ODM,CW-01-01-05/01-01,Supply and install riser on pole or building,Per riser," $	129.23 ",Supply and install riser on pole or building,45403

Lend Lease,Lend Lease - ODM,CW-01-02-01/01-01,Extra over rate for the supply and install of pipe in Rock by any means,Per linear metre," $	159.02 ",Extra over rate for the supply and install of pipe in Rock by any means,45403

Lend Lease,Lend Lease - ODM,CW-02-01-01/01-01,Supply and installation of small pits (P2) at any locations in other than Rock,Per pit," $	192.11 ",Supply and installation of small pits (P2) at any locations in other than Rock,45403

Lend Lease,Lend Lease - ODM,CW-02-01-02/01-01,Supply and installation of medium pits (P4 and P5) at any locations in other than Rock,Per pit," $	393.29 ",Supply and installation of medium pits (P4 and P5) at any locations in other than Rock,45403

Lend Lease,Lend Lease - ODM,CW-02-01-03/01-01,Supply and installation of large pits (P6 and P8) at any locations in other than Rock,Per pit," $	835.70 ",Supply and installation of large pits (P6 and P8) at any locations in other than Rock,45403

Lend Lease,Lend Lease - ODM,CW-02-01-04/01-01,Supply and installation of extra-large (P9) pits at any locations in other than Rock,Per pit," $	1451.08 ",Supply and installation of extra-large (P9) pits at any locations in other than Rock,45403

Lend Lease,Lend Lease - ODM,CW-02-01-05/01-01,Supply and install pit riser,Each pit riser," $	163.43 ",Supply and install pit riser,45403

Lend Lease,Lend Lease - ODM,CW-02-01-06/01-01,Supply and install pit lids,Each pit lids," $	58.17 ",Supply and install pit lids,45403

Lend Lease,Lend Lease - ODM,CW-02-01-08/01-01,Supply and install composite pit lids,Each pit lids," $	37.81 ",Supply and install composite pit lids,45403

Lend Lease,Lend Lease - ODM,CW-02-02-01/01-01,Extra over rate for the supply and installation of a pit in Rock,Per cubic metre," $	196.07 ",Extra over rate for the supply and installation of a pit in Rock,45403

Lend Lease,Lend Lease - ODM,CW-02-03-01/01-01,Removal and disposal of small (2 or 3) ACM Pit,Each ACM Pit," $	345.70 ",Removal and disposal of small (2 or 3) ACM Pit,45403

Lend Lease,Lend Lease - ODM,CW-02-03-02/01-01,Removal and disposal of medium (4) ACM Pit,Each ACM Pit," $	510.50 ",Removal and disposal of medium (4) ACM Pit,45403

Lend Lease,Lend Lease - ODM,CW-02-03-03/01-01,Removal and disposal of large (6 or 8) ACM Pit,Each ACM Pit," $	677.40 ",Removal and disposal of large (6 or 8) ACM Pit,45403

Lend Lease,Lend Lease - ODM,CW-02-03-04/01-01,Removal and disposal of extra large (9) ACM Pit,Each ACM Pit," $	934.77 ",Removal and disposal of extra large (9) ACM Pit,45403

Lend Lease,Lend Lease - ODM,CW-02-04-01/01-01,Remove and dispose of a single lid plastic pit,Each Pit," $	318.85 ",Remove and dispose of a single lid plastic pit,45403

Lend Lease,Lend Lease - ODM,CW-02-04-02/01-01,Remove and dispose of a double lid plastic pit,Each Pit," $	619.99 ",Remove and dispose of a double lid plastic pit,45403

Lend Lease,Lend Lease - ODM,CW-03-01-01/01-01,Core bore,Each core bore," $	114.77 ",Core bore,45403

Lend Lease,Lend Lease - ODM,CW-04-01-01/01-01,Installation only of single cable by direct buried techniques by any means,Per linear metre," $	15.01 ",Installation only of single cable by direct buried techniques by any means,45403

Lend Lease,Lend Lease - ODM,CW-04-02-01/01-01,Extra over for the installation of a single cable by direct buried techniques in Rock,Per linear metre," $	36.25 ",Extra over for the installation of a single cable by direct buried techniques in Rock,45403

Lend Lease,Lend Lease - ODM,CW-04-03-01/01-01,Supply and install marker posts for buried underground cable,Per marker post," $	65.44 ",Supply and install marker posts for buried underground cable,45403

Lend Lease,Lend Lease - ODM,CW-05-01-01/01-01,Identify and repair a damaged and blocked duct in any surface,Per blockage repaired," $	297.90 ",Identify and repair a damaged and blocked duct in any surface,45403

Lend Lease,Lend Lease - ODM,CW-05-01-02/01-01,Clear pipe blockage using high pressure water,Per blockage cleared," $	144.86 ",Clear pipe blockage using high pressure water,45403

Lend Lease,Lend Lease - ODM,CW-05-01-03/01-01,Extra over for the repair of a secondary damaged or blocked duct in any surface,Per blockage repaired," $	278.46 ",Extra over for the repair of a secondary damaged or blocked duct in any surface,45403

Lend Lease,Lend Lease - ODM,CW-06-01-01/01-01,Breakout concrete surface material,Per linear metre," $	65.48 ",Breakout concrete surface material,45403

Lend Lease,Lend Lease - ODM,CW-06-01-02/01-01,Breakout asphalt or bitumen,Per linear metre," $	59.63 ",Breakout asphalt or bitumen,45403

Lend Lease,Lend Lease - ODM,CW-06-01-03/01-01,Breakout paving material in CBD areas,Per linear metre," $	86.63 ",Breakout paving material in CBD areas,45403

Lend Lease,Lend Lease - ODM,CW-06-01-04/01-01,Breakout paving material in all areas other than CBD,Per linear metre," $	53.18 ",Breakout paving material in all areas other than CBD,45403

Lend Lease,Lend Lease - ODM,CW-06-02-01/01-01,Reinstate concrete surface material,Per linear metre," $	116.82 ",Reinstate concrete surface material,45403

Lend Lease,Lend Lease - ODM,CW-06-02-02/01-01,Reinstate asphalt or bitumen,Per linear metre," $	76.54 ",Reinstate asphalt or bitumen,45403

Lend Lease,Lend Lease - ODM,CW-06-02-03/01-01,Reinstate paving material in CBD areas,Per linear metre," $	97.77 ",Reinstate paving material in CBD areas,45403

Lend Lease,Lend Lease - ODM,CW-06-02-04/01-01,Reinstate paving material in all areas other than CBD,Per linear metre," $	87.69 ",Reinstate paving material in all areas other than CBD,45403

Lend Lease,Lend Lease - ODM,EA-01-01-01/01-01,Copper performance line testing,Per cable pair," $	74.92 ",Copper performance line testing,45403

Lend Lease,Lend Lease - ODM,EA-01-01-02/01-01,Line Testing Vacant Pairs,Per cable pair," $	9.54 ",Line Testing Vacant Pairs,45403

Lend Lease,Lend Lease - ODM,FB-01-01-01/01-01,Installation and preparation of a new fibre joint enclosure greater than 144 fibres,Per fibre joint enclosure," $	272.06 ",Installation and preparation of a new fibre joint enclosure greater than 144 fibres,45403

Lend Lease,Lend Lease - ODM,FB-01-01-02/01-01,Installation and preparation of a new fibre joint enclosure greater than 12 fibres and up to and including 144 fibres,Per fibre joint enclosure," $	185.74 ",Installation and preparation of a new fibre joint enclosure greater than 12 fibres and up to and including 144 fibres,45403

Lend Lease,Lend Lease - ODM,FB-01-01-03/01-01,Installation and preparation of a fibre joint enclosure up to and including 12 fibres,Per fibre joint enclosure," $	134.07 ",Installation and preparation of a fibre joint enclosure up to and including 12 fibres,45403

Lend Lease,Lend Lease - ODM,FB-01-01-04/01-01,Installation and preparation of Gator fibre joint enclosure,Per Gator fibre joint enclosure," $	140.26 ",Installation and preparation of Gator fibre joint enclosure,45403

Lend Lease,Lend Lease - ODM,FB-01-02-01/01-01,Prepare a fibre cable sheath greater than 144 fibres  to be connected to fibre joint enclosures,Per cable sheath," $	219.54 ",Prepare a fibre cable sheath greater than 144 fibres  to be connected to fibre joint enclosures,45403

Lend Lease,Lend Lease - ODM,FB-01-02-02/01-01,Prepare a fibre cable sheath greater 12 fibres and up to and including 144 fibres to be connected to fibre joint enclosures,Per cable sheath," $	122.78 ",Prepare a fibre cable sheath greater 12 fibres and up to and including 144 fibres to be connected to fibre joint enclosures,45403

Lend Lease,Lend Lease - ODM,FB-01-02-03/01-01,Prepare a 12 fibre cable to be connected to fibre joint enclosures,Per cable sheath," $	59.01 ",Prepare a 12 fibre cable to be connected to fibre joint enclosures,45403

Lend Lease,Lend Lease - ODM,FB-01-02-04/01-01,Prepare Single fibre cable sheath to be connected to fibre joint enclosures,Per cable sheath," $	45.63 ",Prepare Single fibre cable sheath to be connected to fibre joint enclosures,45403

Lend Lease,Lend Lease - ODM,FB-01-02-05/01-01,Lay up of cable sheaths,Per cable sheath," $	83.48 ",Lay up of cable sheaths,45403

Lend Lease,Lend Lease - ODM,FB-01-02-06/01-01,Prepare a loose tube fibre cable sheath greater than 144 fibres to be connected to fibre joint enclosures,Per cable sheath," $	299.54 ",Prepare a loose tube fibre cable sheath greater than 144 fibres to be connected to fibre joint enclosures,45403

Lend Lease,Lend Lease - ODM,FB-01-02-07/01-01,Prepare a loose tube fibre cable sheath greater 12 fibres and up to and including 144 fibres to be connected to fibre joint enclosures,Per cable sheath," $	205.71 ",Prepare a loose tube fibre cable sheath greater 12 fibres and up to and including 144 fibres to be connected to fibre joint enclosures,45403

Lend Lease,Lend Lease - ODM,FB-01-02-08/01-01,Prepare a loose tube 12 fibre cable to be connected to fibre joint enclosures,Per cable sheath," $	93.96 ",Prepare a loose tube 12 fibre cable to be connected to fibre joint enclosures,45403

Lend Lease,Lend Lease - ODM,FB-01-02-09/01-01,Prepare a loose tube Single fibre cable sheath to be connected to fibre joint enclosures,Per cable sheath," $	47.62 ",Prepare a loose tube Single fibre cable sheath to be connected to fibre joint enclosures,45403

Lend Lease,Lend Lease - ODM,FB-01-03-01/01-01,Re-entry into a fibre joint enclosure,Per fibre joint enclosure," $	82.37 ",Re-entry into a fibre joint enclosure,45403

Lend Lease,Lend Lease - ODM,FB-01-04-01/01-01,Installation of splitter within existing FDH / PDH cabinet,Per splitter," $	38.40 ",Installation of splitter within existing FDH / PDH cabinet,45403

Lend Lease,Lend Lease - ODM,FB-01-04-02/01-01,Installation of splitter within an existing BJL enclosure,Per splitter," $	73.15 ",Installation of splitter within an existing BJL enclosure,45403

Lend Lease,Lend Lease - ODM,FB-01-04-03/01-01,Installation of splitter within an existing FJL enclosure,Per splitter," $	85.24 ",Installation of splitter within an existing FJL enclosure,45403

Lend Lease,Lend Lease - ODM,FB-01-04-04/01-01,Installation of a splitter card output fibres to LFN ports within and existing FDH cabinet,Per Fibre," $	38.91 ",Installation of a splitter card output fibres to LFN ports within and existing FDH cabinet,45403

Lend Lease,Lend Lease - ODM,FB-01-04-05/01-01,Installation of a Fibre TV Splitter (TVS) within an FDH Cabinet,Per device," $	35.75 ",Installation of a Fibre TV Splitter (TVS) within an FDH Cabinet,45403

Lend Lease,Lend Lease - ODM,FB-01-04-06/01-01,Installation of a Fibre TV Splitter within a PDH enclosure,Per device," $	38.63 ",Installation of a Fibre TV Splitter within a PDH enclosure,45403

Lend Lease,Lend Lease - ODM,FB-02-01-01/01-01,Installation of multiport or splitter multiport in underground pit or manhole,Per multiport," $	29.83 ",Installation of multiport or splitter multiport in underground pit or manhole,45403

Lend Lease,Lend Lease - ODM,FB-02-01-02/01-01,Installation of multiport or splitter multiport on any pole,Per multiport," $	114.69 ",Installation of multiport or splitter multiport on any pole,45403

Lend Lease,Lend Lease - ODM,FB-02-01-03/01-01,Replacement or Upgrade of existing splitter multiport in underground pit or manhole,Per multiport," $	60.49 ",Replacement or Upgrade of existing splitter multiport in underground pit or manhole,45403

Lend Lease,Lend Lease - ODM,FB-02-01-04/01-01,Replacement or Upgrade of existing splitter multiport on any pole,Per multiport," $	173.28 ",Replacement or Upgrade of existing splitter multiport on any pole,45403

Lend Lease,Lend Lease - ODM,FB-03-01-01/01-01,Splicing of optic fibre ribbons,Per Ribbon Splice," $	19.24 ",Splicing of optic fibre ribbons,45403

Lend Lease,Lend Lease - ODM,FB-03-01-02/01-01,Splicing of single fibre,Per Fibre Splice," $	13.11 ",Splicing of single fibre,45403

Lend Lease,Lend Lease - ODM,FB-03-01-03/01-01,Splicing of loose tube fibre,Per Fibre Splice," $	12.29 ",Splicing of loose tube fibre,45403

Lend Lease,Lend Lease - ODM,FB-03-01-04/01-01,De ribbonise 12 fibre ribbon,Per ribbon," $	4.72 ",De ribbonise 12 fibre ribbon,45403

Lend Lease,Lend Lease - ODM,FB-04-02-01/01-01,Uni-directional OTDR Testing to the first fibre tested,Per fibre," $	18.56 ",Uni-directional OTDR Testing to the first fibre tested,45403

Lend Lease,Lend Lease - ODM,FB-04-02-02/01-01,Extra over for additional Uni-directional OTDR Testing,Per fibre," $	18.03 ",Extra over for additional Uni-directional OTDR Testing,45403

Lend Lease,Lend Lease - ODM,FB-04-02-03/01-01,Point to point DFL OTDR test to the first fibre tested,Per fibre," $	28.07 ",Point to point DFL OTDR test to the first fibre tested,45403

Lend Lease,Lend Lease - ODM,FB-04-02-04/01-01,Extra over for additional Point to point DFL OTDR test,Per fibre," $	13.65 ",Extra over for additional Point to point DFL OTDR test,45403

Lend Lease,Lend Lease - ODM,FB-04-02-05/01-01,Insertion loss testing to the first fibre tested,Per fibre," $	17.72 ",Insertion loss testing to the first fibre tested,45403

Lend Lease,Lend Lease - ODM,FB-04-02-06/01-01,Extra over for additional Insertion loss testing,Per fibre," $	16.76 ",Extra over for additional Insertion loss testing,45403

Lend Lease,Lend Lease - ODM,FB-04-02-07/01-01,Extra over rate for LFN / MTLFN insertion loss testing to the PCD,Per fibre," $	13.65 ",Extra over rate for LFN / MTLFN insertion loss testing to the PCD,45403

Lend Lease,Lend Lease - ODM,FB-04-02-08/01-01,PON Power Meter Test,Per fibre," $	15.70 ",PON Power Meter Test,45403

Lend Lease,Lend Lease - ODM,FB-04-02-09/01-01,End to end connectivity testing to the GPON NTD at customer premises,Per fibre," $	29.29 ",End to end connectivity testing to the GPON NTD at customer premises,45403

Lend Lease,Lend Lease - ODM,FB-04-02-10/01-01,End to end connectivity testing to SASK NTD at customer premises,Per fibre," $	29.29 ",End to end connectivity testing to SASK NTD at customer premises,45403

Lend Lease,Lend Lease - ODM,FB-05-02-01/01-01,Installation of a 12/24 way fibre patch panel within a customer premise environment,Per patch panel," $	57.79 ",Installation of a 12/24 way fibre patch panel within a customer premise environment,45403

Lend Lease,Lend Lease - ODM,FB-05-02-04/01-01,Installation of a 24 way HDODF patch panel within a HDODF or equivalent environment,Per patch panel," $	116.40 ",Installation of a 24 way HDODF patch panel within a HDODF or equivalent environment,45403

Lend Lease,Lend Lease - ODM,FB-05-02-05/01-01,Installation of a 72 way HDODF patch panel within a HDODF or equivalent environment,Per patch panel," $	155.21 ",Installation of a 72 way HDODF patch panel within a HDODF or equivalent environment,45403

