Lend Lease,Lend Lease - ODM,FB-05-02-06/01-01,Installation of a 144 way HDODF patch panel within a HDODF or equivalent environment,Per patch panel," $	191.01 ",Installation of a 144 way HDODF patch panel within a HDODF or equivalent environment,45403

Lend Lease,Lend Lease - ODM,FB-05-03-01/01-01,Prepare and splice of a 12 fibre sheath within a customer premises environment,Per cable sheath," $	87.85 ",Prepare and splice of a 12 fibre sheath within a customer premises environment,45403

Lend Lease,Lend Lease - ODM,FB-05-03-02/01-01,Prepare and splice of a single fibre in a PIC cable,Per Fibre," $	32.57 ",Prepare and splice of a single fibre in a PIC cable,45403

Lend Lease,Lend Lease - ODM,FB-05-03-03/01-01,Supply and install patching cable within a HDODF or equivalent environment,Per patching cable," $	38.34 ",Supply and install patching cable within a HDODF or equivalent environment,45403

Lend Lease,Lend Lease - ODM,FB-05-03-06/01-01,Prepare and splice a fibre cable sheath greater than 144 fibres to be connected within a HDODF environment,Per cable sheath," $	262.25 ",Prepare and splice a fibre cable sheath greater than 144 fibres to be connected within a HDODF environment,45403

Lend Lease,Lend Lease - ODM,FB-05-03-07/01-01,Prepare and splice a fibre cable sheath greater 12 fibres and up to and including 144 fibres to be connected within a HDODF environment,Per cable sheath," $	134.24 ",Prepare and splice a fibre cable sheath greater 12 fibres and up to and including 144 fibres to be connected within a HDODF environment,45403

Lend Lease,Lend Lease - ODM,FB-05-03-08/01-01,Installation of an inline optical attenuator in conjunction with HDODF patching works,Per optical attenuator," $	48.87 ",Installation of an inline optical attenuator in conjunction with HDODF patching works,45403

Lend Lease,Lend Lease - ODM,FB-05-03-09/01-01,"Installation of an inline optical attenuator within the HDODF cabinet or equivalent rack environments as part of line balancing works for an FTTC DPU",Per optical attenuator," $	100.70 ","Installation of an inline optical attenuator within the HDODF cabinet or equivalent rack environments as part of line balancing works for an FTTC DPU",45403

Lend Lease,Lend Lease - ODM,FB-06-01-01/01-01,Removal of existing fibre joint enclosure,Per fibre joint enclosure," $	67.13 ",Removal of existing fibre joint enclosure,45403

Lend Lease,Lend Lease - ODM,FC-01-01-03/01-01,Installation and commissioning of a wall mounted DPU terminal device,Per DPU," $	59.94 ",Installation and commissioning of a wall mounted DPU terminal device,45403

Lend Lease,Lend Lease - ODM,FC-01-01-10/01-01,Installation and commissioning of an aerial DPU terminal device,Per DPU," $	101.67 ",Installation and commissioning of an aerial DPU terminal device,45403

Lend Lease,Lend Lease - ODM,FC-01-01-11/01-01,Installation and commissioning of a non-aerial DPU terminal device,Per DPU," $	43.83 ",Installation and commissioning of a non-aerial DPU terminal device,45403

Lend Lease,Lend Lease - ODM,FC-01-01-12/01-01,Removal of existing DPU,Per DPU," $	92.18 ",Removal of existing DPU,45403

Lend Lease,Lend Lease - ODM,FC-02-01-05/01-01,Supply and installation of a DPU copper lead extension from DPU copper lead to a new or existing aerial mounted openable joint enclosure or to an existing aerial mounted terminal box joint enclosure,Per DPU copper lead extension," $	124.56 ",Supply and installation of a DPU copper lead extension from DPU copper lead to a new or existing aerial mounted openable joint enclosure or to an existing aerial mounted terminal box joint enclosure,45403

Lend Lease,Lend Lease - ODM,FC-02-01-06/01-01,Supply and installation of DPU copper lead extension from DPU copper lead to a new or existing non-aerial mounted openable joint enclosure,Per DPU copper lead extension," $	98.39 ",Supply and installation of DPU copper lead extension from DPU copper lead to a new or existing non-aerial mounted openable joint enclosure,45403

Lend Lease,Lend Lease - ODM,FC-02-01-07/01-01,Supply and installation of a DPU copper lead extension from DPU copper lead to a non-aerial copper interconnect unit,Per DPU copper lead extension," $	93.10 ",Supply and installation of a DPU copper lead extension from DPU copper lead to a non-aerial copper interconnect unit,45403

Lend Lease,Lend Lease - ODM,FC-02-01-12/01-01,Installation of a DPU 2 pair high twist copper lead extension from DPU copper lead to a new or existing aerial mounted openable joint enclosure or to an existing aerial mounted terminal box joint enclosure,Per DPU copper lead high twist extension," $	122.18 ",Installation of a DPU 2 pair high twist copper lead extension from DPU copper lead to a new or existing aerial mounted openable joint enclosure or to an existing aerial mounted terminal box joint enclosure,45403

Lend Lease,Lend Lease - ODM,FC-02-01-13/01-01,Installation of a DPU 2 pair high twist copper lead extension from DPU copper lead to a new or existing non-aerial mounted openable joint enclosure,Per DPU copper lead high twist extension," $	17.56 ",Installation of a DPU 2 pair high twist copper lead extension from DPU copper lead to a new or existing non-aerial mounted openable joint enclosure,45403

Lend Lease,Lend Lease - ODM,FC-02-02-01/01-01,Jointing of an aerial copper drop sheath to aerial DPU copper lead in a new or existing openable joint enclosure,Per aerial DPU copper lead jointed," $	98.00 ",Jointing of an aerial copper drop sheath to aerial DPU copper lead in a new or existing openable joint enclosure,45403

Lend Lease,Lend Lease - ODM,FC-02-02-02/01-01,Installation of a DPU 2 pair high twist copper lead extension from DPU copper lead to a new or existing aerial mounted openable joint enclosure,Per DPU copper lead high twist extension," $	121.21 ",Installation of a DPU 2 pair high twist copper lead extension from DPU copper lead to a new or existing aerial mounted openable joint enclosure,45403

Lend Lease,Lend Lease - ODM,FC-02-02-03/01-01,Removal of an existing terminal box joint enclosure or existing openable joint and installation of a new replacement openable joint enclosure,Per replaced enclosure," $	29.81 ",Removal of an existing terminal box joint enclosure or existing openable joint and installation of a new replacement openable joint enclosure,45403

Lend Lease,Lend Lease - ODM,FC-02-02-04/01-01,Installation of a copper tie cable for interconnection between two new or existing openable joint enclosures or terminal box joint enclosures,Per copper tie cable," $	42.76 ",Installation of a copper tie cable for interconnection between two new or existing openable joint enclosures or terminal box joint enclosures,45403

Lend Lease,Lend Lease - ODM,FC-02-03-01/01-01,Installation of a new non-aerial openable joint enclosure,"Per new non-aerial openable joint enclosure"," $	98.00 ",Installation of a new non-aerial openable joint enclosure,45403

Lend Lease,Lend Lease - ODM,FC-02-03-02/01-01,Jointing of copper drop sheath to DPU copper lead using a copper interconnect unit,Per DPU copper lead jointed," $	29.81 ",Jointing of copper drop sheath to DPU copper lead using a copper interconnect unit,45403

Lend Lease,Lend Lease - ODM,FC-02-03-03/01-01,Jointing of copper drop sheath to DPU copper lead in a new or existing openable joint enclosure,Per DPU copper lead jointed," $	42.76 ",Jointing of copper drop sheath to DPU copper lead in a new or existing openable joint enclosure,45403

Lend Lease,Lend Lease - ODM,FC-02-03-04/01-01,Installation of a DPU 2 pair high twist copper lead extension from DPU copper lead to a non-aerial copper interconnect unit,Per DPU copper lead high twist extension," $	93.10 ",Installation of a DPU 2 pair high twist copper lead extension from DPU copper lead to a non-aerial copper interconnect unit,45403

Lend Lease,Lend Lease - ODM,FC-02-03-05/01-01,Installation of a DPU 2 pair high twist copper lead extension from DPU copper lead to a new or existing non-aerial openable joint enclosure,Per DPU copper lead high twist extension," $	129.11 ",Installation of a DPU 2 pair high twist copper lead extension from DPU copper lead to a new or existing non-aerial openable joint enclosure,45403

Lend Lease,Lend Lease - ODM,FC-02-03-06/01-01,Extra over for the Installation of a 2 pair copper cut-in loop to existing lead sheath copper lead-in,Per 2pair loop," $	93.21 ",Extra over for the Installation of a 2 pair copper cut-in loop to existing lead sheath copper lead-in,45403

Lend Lease,Lend Lease - ODM,FC-03-01-01/01-01,Existing copper drop sheath validation,Per existing copper drop sheath validated," $	31.90 ",Existing copper drop sheath validation,45403

Lend Lease,Lend Lease - ODM,FC-03-01-02/01-01,Existing Copper drop sheath validation for Serviceability for Missed Lead-ins,Per existing copper drop sheath validated," $	28.96 ",Existing Copper drop sheath validation for Serviceability for Missed Lead-ins,45403

Lend Lease,Lend Lease - ODM,HF-01-01-01/01-01,Installation of aerial bridger amplifier in new network,Per bridger amplifier," $	225.65 ",Installation of aerial bridger amplifier in new network,45403

Lend Lease,Lend Lease - ODM,HF-01-01-02/01-01,Installation of aerial bridger amplifier in existing network,Per bridger amplifier," $	225.65 ",Installation of aerial bridger amplifier in existing network,45403

Lend Lease,Lend Lease - ODM,HF-01-01-03/01-01,Installation of aerial line-extender amplifier in new network,Per line-extender amplifier," $	166.44 ",Installation of aerial line-extender amplifier in new network,45403

Lend Lease,Lend Lease - ODM,HF-01-01-04/01-01,Installation of aerial line-extender amplifier to existing network,Per line-extender amplifier," $	170.29 ",Installation of aerial line-extender amplifier to existing network,45403

Lend Lease,Lend Lease - ODM,HF-01-01-05/01-01,"Installation of aerial directional coupler, network splitter, line equaliser or line power inserter in new network",Per coupler or network splitter or line power inserter," $	124.89 ","Installation of aerial directional coupler, network splitter, line equaliser or line power inserter in new network",45403

Lend Lease,Lend Lease - ODM,HF-01-01-06/01-01,"Installation of aerial mounted directional coupler, network splitter, line equaliser or line power inserter in existing network",Per coupler or network splitter or line power inserter," $	145.58 ","Installation of aerial mounted directional coupler, network splitter, line equaliser or line power inserter in existing network",45403

Lend Lease,Lend Lease - ODM,HF-01-01-07/01-01,Installation of aerial line power supply in new network,Per line power supply," $	1882.36 ",Installation of aerial line power supply in new network,45403

Lend Lease,Lend Lease - ODM,HF-01-01-08/01-01,Installation of aerial line power supply in existing network,Per line power supply," $	1882.36 ",Installation of aerial line power supply in existing network,45403

Lend Lease,Lend Lease - ODM,HF-01-01-09/01-01,Installation of pedestal mounted line power supply in new network,Per line power supply," $	3340.96 ",Installation of pedestal mounted line power supply in new network,45403

Lend Lease,Lend Lease - ODM,HF-01-01-10/01-01,Installation of pedestal mounted line power supply in existing network,Per line power supply," $	3340.96 ",Installation of pedestal mounted line power supply in existing network,45403

Lend Lease,Lend Lease - ODM,HF-01-01-11/01-01,Installation of aerial tap in new network,Per tap," $	110.47 ",Installation of aerial tap in new network,45403

Lend Lease,Lend Lease - ODM,HF-01-01-12/01-01,Installation of aerial tap in existing network,Per tap," $	143.89 ",Installation of aerial tap in existing network,45403

Lend Lease,Lend Lease - ODM,HF-01-01-13/01-01,Installation of aerial mounted power blocker in existing network,per device," $	105.33 ",Installation of aerial mounted power blocker in existing network,45403

Lend Lease,Lend Lease - ODM,HF-01-01-14/01-01,Installation of aerial RF splice in existing network,Per Splice," $	95.44 ",Installation of aerial RF splice in existing network,45403

Lend Lease,Lend Lease - ODM,HF-01-01-15/01-01,"Installation of an earth to an existing aerial active device where no earth has been provided or is unserviceable",Per device," $	118.70 ","Installation of an earth to an existing aerial active device where no earth has been provided or is unserviceable",45403

Lend Lease,Lend Lease - ODM,HF-01-01-16/01-01,Installation of tie-cabling from PCD to wall plate,Per wall plate," $	141.69 ",Installation of tie-cabling from PCD to wall plate,45403

Lend Lease,Lend Lease - ODM,HF-01-02-04/01-01,Replacement of aerial tap face plate in the existing network,Per face plate," $	96.52 ",Replacement of aerial tap face plate in the existing network,45403

Lend Lease,Lend Lease - ODM,HF-01-02-05/01-01,Replacement of existing PCD with a lock box,Per PCD," $	51.05 ",Replacement of existing PCD with a lock box,45403

Lend Lease,Lend Lease - ODM,HF-01-03-01/01-01,Removal of aerial bridger amplifier or aerial line extender amplifier in existing network,Per device," $	161.90 ",Removal of aerial bridger amplifier or aerial line extender amplifier in existing network,45403

Lend Lease,Lend Lease - ODM,HF-01-03-02/01-01,Removal of aerial coupler or aerial network splitter in existing network,Per device," $	107.19 ",Removal of aerial coupler or aerial network splitter in existing network,45403

Lend Lease,Lend Lease - ODM,HF-01-03-03/01-01,Removal of aerial tap in existing network,Per tap," $	51.83 ",Removal of aerial tap in existing network,45403

Lend Lease,Lend Lease - ODM,HF-01-03-04/01-01,Removal of aerial terminator in existing network,Per terminator," $	35.08 ",Removal of aerial terminator in existing network,45403

Lend Lease,Lend Lease - ODM,HF-01-03-05/01-01,Removal of aerial power blocker in existing network,per device," $	116.81 ",Removal of aerial power blocker in existing network,45403

Lend Lease,Lend Lease - ODM,HF-01-03-06/01-01,"Removal of existing aerial line power supply, line power inserter and pedestal housing in existing network",Per pedestal housing," $	311.53 ","Removal of existing aerial line power supply, line power inserter and pedestal housing in existing network",45403

Lend Lease,Lend Lease - ODM,HF-02-01-01/01-01,Installation of non-aerial bridger amplifier in new network,Per bridge amplifier," $	108.29 ",Installation of non-aerial bridger amplifier in new network,45403

Lend Lease,Lend Lease - ODM,HF-02-01-02/01-01,Installation of non-aerial bridger amplifier in existing network,Per bridge amplifier," $	118.43 ",Installation of non-aerial bridger amplifier in existing network,45403

Lend Lease,Lend Lease - ODM,HF-02-01-03/01-01,Installation of non-aerial line-extender amplifier in new network,Per line-extender amplifier," $	95.57 ",Installation of non-aerial line-extender amplifier in new network,45403

Lend Lease,Lend Lease - ODM,HF-02-01-04/01-01,Installation of non-aerial line-extender amplifier to existing network,Per line-extender amplifier," $	103.93 ",Installation of non-aerial line-extender amplifier to existing network,45403

Lend Lease,Lend Lease - ODM,HF-02-01-05/01-01,"Installation of non-aerial directional coupler, network splitter, line equaliser or line power inserter in new network",Per coupler or network splitter or line power inserter," $	73.75 ","Installation of non-aerial directional coupler, network splitter, line equaliser or line power inserter in new network",45403

Lend Lease,Lend Lease - ODM,HF-02-01-06/01-01,"Installation of non-aerial directional coupler, network splitter, line equaliser or line power inserter in existing network",Per coupler or network splitter or line power inserter," $	89.10 ","Installation of non-aerial directional coupler, network splitter, line equaliser or line power inserter in existing network",45403

Lend Lease,Lend Lease - ODM,HF-02-01-07/01-01,Installation of non-aerial mounted tap in new network,Per tap," $	45.95 ",Installation of non-aerial mounted tap in new network,45403

Lend Lease,Lend Lease - ODM,HF-02-01-08/01-01,Installation of non-aerial tap in existing network,Per tap," $	79.44 ",Installation of non-aerial tap in existing network,45403

Lend Lease,Lend Lease - ODM,HF-02-01-09/01-01,Supply and install optical patch cable within HDODF,Per patch cable," $	34.89 ",Supply and install optical patch cable within HDODF,45403

Lend Lease,Lend Lease - ODM,HF-02-01-10/01-01,Supply and Installation of pedestal,Per pedestal," $	1154.68 ",Supply and Installation of pedestal,45403

Lend Lease,Lend Lease - ODM,HF-02-01-11/01-01,Installation of non-aerial power blocker in existing network,per device," $	50.35 ",Installation of non-aerial power blocker in existing network,45403

Lend Lease,Lend Lease - ODM,HF-02-01-12/01-01,Installation of non-aerial RF splice in existing network,Per Splice," $	44.33 ",Installation of non-aerial RF splice in existing network,45403

Lend Lease,Lend Lease - ODM,HF-02-01-13/01-01,Installation of power blocker in conjunction with the installation of a new device in either aerial or non-aerial environment in new network,per device," $	34.17 ",Installation of power blocker in conjunction with the installation of a new device in either aerial or non-aerial environment in new network,45403

Lend Lease,Lend Lease - ODM,HF-02-01-14/01-01,Installation of an earth to an existing non aerial active device where no earth has been provided,Per device," $	108.69 ",Installation of an earth to an existing non aerial active device where no earth has been provided,45403

Lend Lease,Lend Lease - ODM,HF-02-02-03/01-01,Replacement of non-aerial tap face plate in the existing network,Per face plate," $	42.14 ",Replacement of non-aerial tap face plate in the existing network,45403

Lend Lease,Lend Lease - ODM,HF-02-02-04/01-01,"Installation of an earth to an existing non aerial active device where the existing earth is unserviceable",Per earth," $	79.45 ","Installation of an earth to an existing non aerial active device where the existing earth is unserviceable",45403

Lend Lease,Lend Lease - ODM,HF-02-03-01/01-01,Removal of non-aerial bridger amplifier or non- aerial line extender amplifier in existing network,Per non-aerial bridger amplifier or non-aerial line extender amplifier device," $	68.81 ",Removal of non-aerial bridger amplifier or non- aerial line extender amplifier in existing network,45403

Lend Lease,Lend Lease - ODM,HF-02-03-02/01-01,Removal of non-aerial coupler or non-aerial network splitter in existing network,Per device," $	83.44 ",Removal of non-aerial coupler or non-aerial network splitter in existing network,45403

Lend Lease,Lend Lease - ODM,HF-02-03-03/01-01,Removal of non-aerial tap in existing network,Per tap," $	44.52 ",Removal of non-aerial tap in existing network,45403

Lend Lease,Lend Lease - ODM,HF-02-03-04/01-01,Removal of non-aerial terminator in existing network,Per terminator," $	26.05 ",Removal of non-aerial terminator in existing network,45403

Lend Lease,Lend Lease - ODM,HF-02-03-05/01-01,Removal of non aerial power blocker in existing network,per device," $	55.99 ",Removal of non aerial power blocker in existing network,45403

Lend Lease,Lend Lease - ODM,HF-02-03-06/01-01,"Removal of existing  line power supply, line power inserter and pedestal housing in existing network",Per pedestal housing," $	243.54 ","Removal of existing  line power supply, line power inserter and pedestal housing in existing network",45403

Lend Lease,Lend Lease - ODM,HF-03-01-01/01-01,Proof of performance testing,per device," $	86.60 ",Proof of performance testing,45403

Lend Lease,Lend Lease - ODM,HF-03-01-02/01-01,Return path noise testing of an optical node in the existing network,Per optical node," $	113.98 ",Return path noise testing of an optical node in the existing network,45403

Lend Lease,Lend Lease - ODM,HF-03-02-01/01-01,Alignment of aerial HFC active equipment,Per HFC active equipment," $	281.26 ",Alignment of aerial HFC active equipment,45403

Lend Lease,Lend Lease - ODM,HF-03-02-02/01-01,Alignment of non-aerial HFC active equipment,Per HFC active equipment," $	74.21 ",Alignment of non-aerial HFC active equipment,45403

Lend Lease,Lend Lease - ODM,HF-03-02-04/01-01,Reconfigure output of aerial directional coupler or aerial network splitter in an existing network,per device," $	122.38 ",Reconfigure output of aerial directional coupler or aerial network splitter in an existing network,45403

Lend Lease,Lend Lease - ODM,HF-03-02-05/01-01,Reconfigure output non-aerial directional coupler or network splitter in existing network,per device," $	77.74 ",Reconfigure output non-aerial directional coupler or network splitter in existing network,45403

Lend Lease,Lend Lease - ODM,HF-04-01-01/01-01,Earthing of catenary wire,Per earth," $	119.39 ",Earthing of catenary wire,45403

Lend Lease,Lend Lease - ODM,LL-01-01-01/01-04,Supply and Install TDUX,Per TDUX," $	80.00 ",Supply and Install TDUX,45403

Lend Lease,Lend Lease - ODM,LL-01-01-01/01-05,Supply and Install Cable Bearer,Per cable bearer," $	50.00 ",Supply and Install Cable Bearer,45403

Lend Lease,Lend Lease - ODM,MD-01-01-01/01-01,Supply & Installation of catenary wire system in buildings,Per linear metre," $	10.65 ",Supply & Installation of catenary wire system in buildings,45403

Lend Lease,Lend Lease - ODM,MD-01-01-01-AH/01-01,Supply & Installation of catenary wire system in buildings outside working hours,Per linear metre," $	23.89 ",Supply & Installation of catenary wire system in buildings outside working hours,45403

Lend Lease,Lend Lease - ODM,MD-01-01-02/01-01,Supply & Installation of cable tray in buildings,Per linear metre," $	36.79 ",Supply & Installation of cable tray in buildings,45403

Lend Lease,Lend Lease - ODM,MD-01-01-02-AH/01-01,Supply & Installation of cable tray in buildings outside working hours,Per linear metre," $	54.17 ",Supply & Installation of cable tray in buildings outside working hours,45403

Lend Lease,Lend Lease - ODM,MD-01-01-03/01-01,Supply and installation of ducting <30mm width,Per linear metre," $	18.21 ",Supply and installation of ducting <30mm width,45403

Lend Lease,Lend Lease - ODM,MD-01-01-03-AH/01-01,Supply and installation of ducting <30mm width outside working hours,Per linear metre," $	26.94 ",Supply and installation of ducting <30mm width outside working hours,45403

Lend Lease,Lend Lease - ODM,MD-01-01-04/01-01,Supply and installation of ducting >30mm width,Per linear metre," $	29.02 ",Supply and installation of ducting >30mm width,45403

Lend Lease,Lend Lease - ODM,MD-01-01-04-AH/01-01,Supply and installation of ducting >30mm width outside working hours,Per linear metre," $	49.33 ",Supply and installation of ducting >30mm width outside working hours,45403

Lend Lease,Lend Lease - ODM,MD-01-01-05/01-01,Supply and installation of conduit,Per linear metre," $	9.32 ",Supply and installation of conduit,45403

Lend Lease,Lend Lease - ODM,MD-01-01-05-AH/01-01,Supply and installation of conduit outside working hours,Per linear metre," $	14.08 ",Supply and installation of conduit outside working hours,45403

Lend Lease,Lend Lease - ODM,MD-01-01-06/01-01,Installation of One Pass Fibre Pathway in buildings,Per linear metre," $	10.90 ",Installation of One Pass Fibre Pathway in buildings,45403

Lend Lease,Lend Lease - ODM,MD-01-01-06-AH/01-01,Installation of One Pass Fibre Pathway in buildings outside working hours,Per linear metre," $	15.58 ",Installation of One Pass Fibre Pathway in buildings outside working hours,45403

Lend Lease,Lend Lease - ODM,MD-01-01-07/01-01,Connecting One Pass Fibre Pathway to ICD or PCD,Each ICD or PCD," $	40.55 ",Connecting One Pass Fibre Pathway to ICD or PCD,45403

Lend Lease,Lend Lease - ODM,MD-01-01-07-AH/01-01,Connecting One Pass Fibre Pathway to ICD or PCD outside working hours,Each ICD or PCD," $	56.77 ",Connecting One Pass Fibre Pathway to ICD or PCD outside working hours,45403

Lend Lease,Lend Lease - ODM,MD-01-07-01/01-01,"Installation of Fibre Collector Distributor (FCD) or Fibre Distribution Terminal (FDT) or Cable Transition Location (CTL) within buildings","Each FCD, FDT or CTL"," $	95.13 ","Installation of Fibre Collector Distributor (FCD) or Fibre Distribution Terminal (FDT) or Cable Transition Location (CTL) within buildings",45403

Lend Lease,Lend Lease - ODM,MD-01-07-01-AH/01-01,Installation of Fibre Collector Distributor (FCD) or Fibre Distribution Terminal (FDT) or Cable Transition Location (CTL) within buildings outside working hours,"Each FCD, FDT or CTL"," $	146.06 ",Installation of Fibre Collector Distributor (FCD) or Fibre Distribution Terminal (FDT) or Cable Transition Location (CTL) within buildings outside working hours,45403

Lend Lease,Lend Lease - ODM,MD-01-07-02/01-01,Installation of Premises Distribution Hub (PDH),Each PDH," $	198.21 ",Installation of Premises Distribution Hub (PDH),45403

Lend Lease,Lend Lease - ODM,MD-01-07-02-AH/01-01,Installation of Premises Distribution Hub (PDH) outside working hours,Each PDH," $	231.91 ",Installation of Premises Distribution Hub (PDH) outside working hours,45403

Lend Lease,Lend Lease - ODM,MD-01-07-03/01-01,Installation of Internal Connection Device (ICD) or Premises Connection Device (PCD),Each ICD or PCD," $	33.12 ",Installation of Internal Connection Device (ICD) or Premises Connection Device (PCD),45403

Lend Lease,Lend Lease - ODM,MD-01-07-03-AH/01-01,Installation of Internal Connection Device (ICD) or Premises Connection Device (PCD) outside working hours,Each ICD or PCD," $	46.73 ",Installation of Internal Connection Device (ICD) or Premises Connection Device (PCD) outside working hours,45403

