Downer,Downer - Fusion,FC-02-01-08,Installation of a copper tie cable for interconnection between two new or existing openable joint enclosures or terminal box joint enclosures,Per copper tie cable, $	157.92 
Downer,Downer - Fusion,FC-02-01-09,Extra over for the Installation of a 2 pair copper cut-in loop to existing lead sheath copper lead-in,Per 2pair loop, $	35.23 
Downer,Downer - Fusion,FC-02-01-10,"Removal of an existing terminal box joint enclosure or existing openable joint and installation of a new replacement
openable joint enclosure",Per replaced enclosure, $	122.66 
Downer,Downer - Fusion,FC-02-01-11,Installation of a DPU 2 pair high twist copper lead extension from DPU copper lead to a non-aerial copper interconnect unit,Per DPU copper lead high twist extension, $	130.62 
Downer,Downer - Fusion,FC-02-01-12,"Installation of a DPU 2 pair high twist copper lead extension from DPU copper lead to a new or existing aerial mounted openable joint enclosure or to an existing aerial mounted
terminal box joint enclosure",Per DPU copper lead high twist extension, $	126.11 
Downer,Downer - Fusion,FC-02-01-13,"Installation of a DPU 2 pair high twist copper lead extension from DPU copper lead to a new or existing non-aerial
mounted openable joint enclosure","Per DPU copper lead high twist
extension", $	140.84 
Downer,Downer - Fusion,FC-03-01-01,Existing copper drop sheath validation,"Per existing copper drop
sheath validated", $	30.31 
Downer,Downer - Fusion,FC-03-01-02,Existing Copper drop sheath validation for Serviceability for Missed Lead-ins,Per existing copper drop sheath validated, $	87.10 
Downer,Downer - Fusion,MD-02-01-01,"Installation of a single service drop sheath (SDS) on a single
span to a multi dwelling unit","Per aerial service
drop", $	213.05 
Downer,Downer - Fusion,MD-02-01-02,Extra over rate for additional spans for an aerial service drop to a multi dwelling unit,Each additional Span, $	41.07 
Downer,Downer - Fusion,MD-02-01-03,Extra over rate for supply and installation of an raiser pole on a building.,Each raiser pole installed, $	96.03 
Downer,Downer - Fusion,MD-02-01-04,"Installation of service drop sheath underground to a multi
dwelling unit",Per service drop, $	165.25 
Downer,Downer - Fusion,MD-02-01-05,Installation of direct service drop sheath underground to a multi dwelling unit,Per direct service drop, $	287.95 
Downer,Downer - Fusion,MD-02-02-01,Replace existing copper aerial lead-in with new copper aerial lead-in to a multi dwelling unit,"Per existing copper aerial lead- in replaced. Per
Span", $	171.41 
Downer,Downer - Fusion,MD-02-02-02,Installation of aerial copper service drop to a multi dwelling unit,Per aerial copper service drop, $	188.31 
Downer,Downer - Fusion,MD-02-02-03,Installation of non-aerial copper service drop to a multi dwelling unit,"Per non-aerial
copper service drop", $	131.18 
Downer,Downer - Fusion,SD-01-01-01,"Extra over rate for the supply and install of new lead-in pipe, minimum charge 6 metres route length, by any means",Per linear metre, $	32.86 
Downer,Downer - Fusion,SD-01-01-03,Supply and install of Y connectors,Per Y connector, $	67.76 
Downer,Downer - Fusion,SD-01-01-04,Supply and install new lead-in starter pipe,Per Starter Pipe, $	169.69 
Downer,Downer - Fusion,SD-01-02-01,Extra over rate to repair lead-in conduit,Per repaired lead- in conduit, $	67.76 
Downer,Downer - Fusion,SD-02-01-01,"Installation of a single service drop sheath on a single span to
a single dwelling unit","Per aerial service
drop", $	213.05 
Downer,Downer - Fusion,SD-02-01-02,Extra over rate for additional spans for an aerial service drop to a single dwelling unit,Each additional Span, $	41.07 
Downer,Downer - Fusion,SD-02-01-03,"Installation of service drop sheath underground to a single
dwelling unit",Per service drop, $	165.25 
Downer,Downer - Fusion,SD-02-01-04,Installation of direct service drop sheath underground to a single dwelling unit,Per direct service drop, $	287.95 
Downer,Downer - Fusion,SD-02-02-01,Replace existing copper aerial lead-in with new copper aerial lead-in to a single dwelling unit,"Per existing copper aerial lead- in replaced. Per
Span", $	131.85 
Downer,Downer - Fusion,SD-02-02-02,Installation of aerial copper service drop to a single dwelling unit,Per aerial copper service drop, $	114.79 
Downer,Downer - Fusion,SD-02-02-03,Installation of non-aerial copper service drop to a single dwelling unit,"Per non-aerial copper service
drop", $	100.91 
Downer,Downer - Fusion,CF-02-02-01,"Mobilisation Fee for Planning and Design Works for a Work
Order located in Zone 2",Quote,Quote
Downer,Downer - Fusion,CF-02-02-02,Mobilisation Fee for Planning and Design Works for a Work Order located in Zone 3,Quote,Quote
Downer,Downer - Fusion,CF-02-02-03,"Mobilisation Fee for Planning and Design Works for a Work
Order located in Zone 4",Quote,Quote
Downer,Downer - Fusion,CF-02-02-04,Mobilisation Fee for Construction Works for a Work Order located in Zone 2,Quote,Quote
Downer,Downer - Fusion,CF-02-02-05,Mobilisation Fee for Construction Works for a Work Order located in Zone 3,Quote,Quote
Downer,Downer - Fusion,CF-02-02-06,"Mobilisation Fee for Construction Works for a Work Order
located in Zone 4",Quote,Quote
Downer,Downer - Fusion,CF-03-02-01,LAFHA for Planning and Design or Construction Works for a Work Order located in Zone 2,per night/ per person, $	180.00 
Downer,Downer - Fusion,CF-03-02-02,LAFHA for Planning and Design or Construction Works for a Work Order located in Zone 3,per night/ per person, $	180.00 
Downer,Downer - Fusion,CF-03-02-03,"LAFHA for Planning and Design or Construction Works for a
Work Order located in Zone 4","per night/ per
person", $	180.00 
Downer,Downer - Fusion,PS-01-01-02,Pole make ready works,Cost of pole make ready works,Quote
Downer,Downer - Fusion,PS-01-01-03,Supply and install standard GPO as per design,Cost of GPO installation,Quote
Downer,Downer - Fusion,PS-01-01-04,Certification and professional services fees associated with activities not otherwise specified in Activity Scope,Amount of the fee,Quote
Downer,Downer - Fusion,PS-01-01-05,Registered Surveyor Works,Amount of the fee,Quote
Downer,Downer - Fusion,PS-01-01-07,"Traffic Control - All costs associated with the hire of
professional traffic control units",Amount of the fee,Quote
Downer,Downer - Fusion,PS-01-01-11,Aerial pole replacement,Amount of the fee,Quote
Downer,Downer - Fusion,PS-01-01-12,Third party aerial design management fees,Amount of the fee,Quote
Downer,Downer - Fusion,TB-01-01-05,Labourer,Per hour, $	35.67 
Downer,Downer - Fusion,TB-01-01-06,Labourer - outside working hours,Per hour, $	61.35 
Downer,Downer - Fusion,TB-02-02-03,EWP truck mounted up to 12m,Quote,Quote
Downer,Downer - Fusion,TB-02-02-13,Scissor Lift,Quote,Quote